user,user_idx,time_bin,timestamp,sentiment,text,type,post_id,parent_id
_May26_,15,44,1774623464.0,-0.9727693200111389,"One Month Into Trump's Iran War, Red Cross Says 'Foundations of Civilian Life' Eroding Across Middle East",post,1s56hk6,
_May26_,15,95,1774808685.0,-0.9987761378288269,"As Trump Prepares Iran Ground Assault, Expert Warns He's 'Run Out of Options' for Victory",post,1s72ro9,
_May26_,15,115,1774880425.0,-0.9567843675613403,"Thanks to Trump's Iran War, Over $100 Billion Has Been 'Siphoned From Ordinary People' to Big Oil",post,1s7rxmf,
_May26_,15,122,1774905909.0,-0.9224465489387512,Trump Floats More War Crimes With Threat to Target ‘Possibly All Desalination Plants’ in Iran,post,1s83up6,
jediporcupine,16,0,1774468053.0,-0.9984862208366394,The Iran War has already hurt oil production more than the '70s energy crisis did,post,1s3l6e3,
jediporcupine,16,21,1774541008.0,-0.9995593428611755,"We’ve wasted tens of billions of dollars to achieve something that was already happening?

God this administration is incompetent.",comment,1s4bj33,t3_1s4bj33
jediporcupine,16,26,1774560531.0,-0.9889442920684814,Trump can't TACO his way out of Iran,post,1s4khqj,
jediporcupine,16,42,1774616775.0,-0.9988651275634766,How will Congress fund a $300 billion war with Iran?,post,1s53kbd,
jediporcupine,16,55,1774664429.0,-0.9968916773796082,"Next time you sell yourself to the devil Marco, at least make sure it’s someone competent and not Temu Satan with a cheap orange spray tan.
",comment,1s5lija,t3_1s5lija
jediporcupine,16,92,1774797559.0,-0.9895167946815491,Biblical? These people are legitimately insane,comment,1s6wfpl,t3_1s6wfpl
jediporcupine,16,98,1774819562.0,-0.9880082607269287,House Democrat warns of ‘boots-on-the-ground quagmire’ in Iran,post,1s77i39,
jediporcupine,16,111,1774866163.0,-0.9957666397094727,Graham’s views on Iran war come under attack from Republicans,post,1s7mnoq,
jediporcupine,16,122,1774903890.0,-0.9816092848777771,Trump’s 'military operation' wordplay can’t hide Iran war,post,1s82xvw,
Intel-Source,17,4,1774479122.0,0.9951756000518799,It's an illusion that Trump made up to prevent the stock market from collapsing.,comment,1s3pt2b,t3_1s3pt2b
Intel-Source,17,4,1774482061.0,0.9991156458854675,That's the idea!,comment,1s3js1s,t1_och7s5l
Intel-Source,17,8,1774496065.0,-0.9561359286308289,Trump was lying to keep the stock market from collapsing!,comment,1s3vwj2,t1_ocijtou
Intel-Source,17,11,1774506726.0,-0.989922821521759,And sending in troops?,comment,1s3vwj2,t1_ocj9x20
Intel-Source,17,26,1774558298.0,-0.8188314437866211,The government pays Trump's gas card!,comment,1s4i7kr,t3_1s4i7kr
Intel-Source,17,50,1774646991.0,-0.9900335669517517,They are worried about fallen soldiers coming home.,comment,1s5goo6,t3_1s5goo6
Intel-Source,17,73,1774727921.0,-0.9978379607200623,You don't understand!  Netanyoohoo would be mad at him!,comment,1s60ngn,t1_od07sma
b_tight,18,44,1774626310.0,-0.988353431224823,K@$hword1,comment,1s55u7p,t1_ocs5v21
b_tight,18,58,1774675765.0,0.9785745143890381,"Rubio is also the national security advisor in addition to sec of state.  The last person to hold both such titles at the same time…kissinger.  History doesnt repeat, but it rhymes",comment,1s5lija,t1_ocvfaka
b_tight,18,71,1774721445.0,-0.9995309114456177,If they say ‘i bet youre happy to be right’ counter with ‘im not happy im right.  Im pissed that you were wrong’,comment,1s64qid,t1_oczlcuv
b_tight,18,78,1774748613.0,-0.9968329071998596,To do what?  What is the objective?  What is the mission?,comment,1s6gxhz,t3_1s6gxhz
b_tight,18,93,1774801417.0,-0.9301196932792664,Its a rural vs urban divide.  Maga is literally everywhere outside of cities,comment,1s6x4wq,t1_od58aq1
b_tight,18,115,1774880319.0,-0.9995205402374268,"If true, this is going to get thousands of us troops killed at best.  Thousands more captured at worst",comment,1s7q94h,t3_1s7q94h
b_tight,18,120,1774899562.0,-0.996780276298523,Theyre embarrassed to even admit who they vote for because their candidate is so bad.  Its so frustrating that theyll gladly vote for it again.  I wont give a penny to these people when they need it,comment,1s7zhwz,t1_oddax2c
Ecstatic-Plantain234,19,23,1774549551.0,0.9665387272834778,"At this point, Iran might as well have ayatollah Khamenei shit in a box, wrap it in gift paper, put a bow on it, Fed Ex it to 1600 Pennsylvania Avenue and Trump would be bragging in the media non stop that he got a 'bigly present from Iran this morning. In fact, so bigly that it's unlike anything you've ever seen. Trust me'.",comment,1s4bj33,t3_1s4bj33
Ecstatic-Plantain234,19,47,1774635012.0,-0.8417407274246216,"But, but.... Hillary's emails!",comment,1s5931o,t1_ocsxhm9
Ecstatic-Plantain234,19,114,1774877786.0,-0.9996256828308105,"It's almost as if those septua- and octogenerian ""leaders"" have ZERO clue about what constituents under 65 want: affordable housing, affordable healthcare and affordable groceries.

War is conducive to NONE of those things.",comment,1s7qduv,t3_1s7qduv
Ecstatic-Plantain234,19,115,1774879087.0,0.9907850027084351,"I've been to Kuwait several times and Liberation Day is still celebrated vigorously and they are still VERY thankful the world stood up for them.

I don't really care who or what they find acceptable as their own leader, all they said was ""we do NOT want Saddam Hussein, this country is ours, please help us"".

We shouldn't be striving for regime change in countries that have different ideas on leadership than ours, we should only strive for protection and respect for sovereignity. Nothing more, nothing less.

The war in Kuwait should have been the end but the US took it too far by ousting Saddam Hussein years later. So I agree with you on some level, just not on 1990 alone.",comment,1s7qduv,t1_odb9idf
Ecstatic-Plantain234,19,117,1774887237.0,0.9927491545677185,"Oh, yes, that seems like an excellent way to get the public to rally behind your bogus, already deeply unpopular war.",comment,1s7ubwm,t3_1s7ubwm
Ecstatic-Plantain234,19,121,1774900381.0,0.9995747208595276,"And in return, Iran will do the same to Saudi Arabia, Kuwait, the UAE, etc. etc.

Seems like a solid plan.",comment,1s814g7,t3_1s814g7
IdkAbtAllThat,20,23,1774548042.0,0.9998749494552612,This is the real art of the deal.,comment,1s4bj33,t1_oclrv2z
IdkAbtAllThat,20,52,1774654478.0,-0.9929444193840027,And also I really thought they understood how stupid their base was. They won't lose 60 seats. Those people were ok with child rape. I really don't think a few thousand dead soldiers is going to make them leave the cult.,comment,1s5goo6,t1_ocufbhw
IdkAbtAllThat,20,99,1774824384.0,-0.9958452582359314,Just wait until he drops a nuke and makes the United States a pariah state for the next 50 years.,comment,1s72ro9,t1_od6irk6
IdkAbtAllThat,20,102,1774833220.0,-0.9975489974021912,"Obviously it's not. You've fallen for American propaganda. Our military is strong. They're not omnipotent. Clearly we're not able to defeat Iran easily, or we would have already. 

The most damaging part of this war that no one is talking about is how we've just shown the rest of the world that we're not nearly as dominant, or competent, as everyone thought we were. Maybe China already knew this. But they've got to be feeling much better about their standing militarily after all of this. ",comment,1s79w5y,t1_od8bdcr
IdkAbtAllThat,20,103,1774838090.0,-0.9958853125572205,I think that is the goal here. These psychos want justification to drop a nuke.,comment,1s7chln,t1_od8n59j
IdkAbtAllThat,20,105,1774844454.0,-0.9925386309623718,What have they excused? Nothing even 10% as bad as *nuking millions of civilians*.,comment,1s72ro9,t1_od95bu4
PhoenixTineldyer,21,92,1774797626.0,-0.9984684586524963,You think she'd have different priorities given her condition. Just goes to show that MAGA is a mental illness,comment,1s6wfpl,t1_od55dbc
PhoenixTineldyer,21,96,1774812718.0,0.960834264755249,"I have a friend who goes in there and tells me about the absurdities of it.

I value my free time too much to spend time in nazi spaces.",comment,1s6wfpl,t1_od6o7gz
PhoenixTineldyer,21,103,1774837889.0,-0.9868782162666321,Can't change what you don't have.,comment,1s7chln,t1_od8gayk
PhoenixTineldyer,21,121,1774903321.0,-0.99813312292099,It's much too late for that. His reelection was the coup de grace for America.,comment,1s814g7,t1_oddoc35
Crossstoney,22,9,1774499001.0,-0.9994303584098816,US’ ‘Pivot to Asia’ derailed by Iran campaign,post,1s3xlms,
Crossstoney,22,27,1774561942.0,0.9937312006950378,Trump says he won't call Iran conflict a war. He keeps doing it anyway.,post,1s4l3ke,
Crossstoney,22,42,1774618117.0,-0.9402713179588318,‘Just drinking the Kool-Aid’: Inside the White House divide on Iran,post,1s543uw,
Crossstoney,22,77,1774744670.0,0.971791684627533,Pentagon prepares for weeks of ground operations in Iran,post,1s6gxhz,
Crossstoney,22,80,1774753267.0,-0.9969351291656494,Iran Guards threaten to hit US universities in the Middle East,post,1s6jxap,
Crossstoney,22,92,1774799246.0,-0.9964874982833862,Iran accuses US of ground assault plans as Pakistan hosts regional talks,post,1s6ylhm,
Crossstoney,22,121,1774903255.0,-0.9859728813171387,"US May ‘Reexamine’ NATO’s Merit After Iran War Snub, Rubio Says",post,1s82nsu,
Crossstoney,22,124,1774913782.0,-0.9546778202056885,Shipping industry casts doubt on Donald Trump’s ‘present’ from Iran,post,1s874hi,
kootles10,23,1,1774470460.0,-0.9880161881446838,Iran threatens key Red Sea strait if US launches ground operation,post,1s3mal7,
kootles10,23,26,1774559286.0,-0.5062721371650696,Chuck Grassley calls $200 billion Iran war funding plan a 'no-brainer',post,1s4jyhh,
kootles10,23,76,1774739200.0,-0.8422316908836365,"European allies say Russia is helping Iran more than the U.S. has acknowledged, sources say",post,1s6ew7v,
kootles10,23,100,1774825432.0,-0.9950018525123596,Iran threatens to ‘rain fire’ on US troops as possible ground war looms,post,1s79w5y,
kootles10,23,100,1774825787.0,-0.9976143836975098,In the words of a sign that I saw on Saturday: Bombing for peace is like fucking for virginity ,comment,1s79w5y,t1_od7tsjj
Zulmoka531,24,0,1774465683.0,-0.9920011758804321,There’s also the theory that keeps floating around that Trump isn’t actually in control and [and is being gaslight by his own people only showing him positive morning montages of the war.](https://www.nbcnews.com/politics/white-house/trump-gets-daily-video-montage-briefing-iran-war-rcna263912),comment,1s3js1s,t3_1s3js1s
Zulmoka531,24,4,1774481594.0,-0.9890075922012329,"Then my apologies for using the wrong wording, I was in no way trying to give that fucker a free pass.",comment,1s3js1s,t1_och7fgy
Zulmoka531,24,55,1774662740.0,-0.9851043820381165,"Bannon at CPAC warns Iran war just starting: ‘Your sons, daughters … could be on Kharg Island’",post,1s5ni72,
Zulmoka531,24,55,1774663259.0,-0.9943631887435913,Treating it like a fucking game. Or like it’s an “honor” to die defending Trump’s bullshit.,comment,1s5ni72,t1_ocvvj2y
Zulmoka531,24,57,1774671595.0,-0.9858911633491516,How’s the song go? “I ain’t no senators son”,comment,1s5ni72,t1_ocwcnf3
Zulmoka531,24,78,1774748468.0,-0.9664772748947144,"Trump is in so over his head and not to let him off the hook or anything, he owns this, but it’s becoming clearer everyday that he’s only symbolically calling the shots.",comment,1s6gxhz,t3_1s6gxhz
Virtual-Squirrel-725,25,9,1774496955.0,0.8727509379386902,"Iran will be happy to negotiate for months.

The key thing now is that TIME is on Iran's side.

If the battlefield remains as it is in a month, Iran is stronger and America is desperate.

If it remains the same for three months, Iran is stronger and Trump has an economic and political crisis.

Every military option to open the strait, hastens more economic pain, and won't secure it.

They planned for this, it's not an accident.

Iran's negotiating hand is stronger now that before the war and it will be even stronger in a month.

They know Trump's weakness - the domestic economy and mid-terms.",comment,1s3vwj2,t3_1s3vwj2
Virtual-Squirrel-725,25,10,1774501489.0,-0.9986187219619751,"That's the true marker of failure.  The biggest thing we NEED from these negotiations is something we had before the war.  That's a seriously weakened position.  And we gave them sanctions relief BEFORE the negotiations because we needed it, so we can't exactly threaten it during the negotiations.",comment,1s3vwj2,t1_ocizyde
Virtual-Squirrel-725,25,12,1774509177.0,-0.7659717202186584,"If they do, they are inviting new attacks every six months.",comment,1s3vwj2,t1_ocjcymr
Virtual-Squirrel-725,25,14,1774517048.0,0.9907817244529724,"I think he is more likely to just lose interest, pack up his shit and move on.

I've been watching the war cheerleaders over at Fox and they are fully ready to just declare a glorious victory and spew whatever fake story Trump needs.

",comment,1s3vwj2,t1_ocjsbms
Virtual-Squirrel-725,25,50,1774646107.0,-0.997368335723877,"""Republicans panicking"" is the headline you see two days before ""Republicans back Trump on....""

These are spineless cowards who will do whatever Trump tells them to do.

There is no real ""Republican party"", there are just people who follow orders from Trump.",comment,1s5goo6,t3_1s5goo6
Virtual-Squirrel-725,25,53,1774655503.0,0.9983161687850952,"This is so true.  Trump is the master of providing an ""alternate narrative"" (to normal people they are bullshit lies) and once Trump's foot soldiers know the story they will fall into formation behind it.",comment,1s5goo6,t1_ocup0sw
Virtual-Squirrel-725,25,100,1774826802.0,0.9966046810150146,"Three weeks ago he could have, not anymore.

Iran has their hands on the throat of the world economy and they're not going to let go until they get serious concessions.

",comment,1s79w5y,t1_od7u1qq
guttanzer,26,44,1774623477.0,0.9903309345245361,"And unlike Iraq, the terrain is not favorable.  It's also got a population of 90 million, and most are well educated.  They aren't a bunch of goat herders, they are more like the Ukrainians that are kicking Russia's ass.  And they are on home turf, with a national pride that goes back thousands of years.    
  
Every single Pentagon briefing leading up to this war must have ended with a slide saying, ""There are no winning options.  Everything turns to shit.""  Yet he went ahead anyway.  

We all knew he was stupid and pig headed, but he's proven to be right up there with Caligula, Nero, Hitler, Mao, Stalin, and the 1800's French aristocracy.  He's clearly made it into the history books.  People will be using Trump as an example of how not to run a country for milennia.  
",comment,1s54b1p,t1_ocrs6tp
guttanzer,26,98,1774819991.0,-0.9819419980049133,First they have to describe what victory would be.  Until they do it isn’t an option. ,comment,1s72ro9,t3_1s72ro9
guttanzer,26,114,1774878150.0,-0.9978182315826416,"Harris would have been a much better choice.  Americans would still be calling the shots in foreign policy. 

Lots of other things would be better too. Biden handed off a world where inflation was headed down to 2%, we had scientists working on cures for cancer. She wouldn’t have kept that going. There would be no heavily armed mall cops patrolling our public places, tear gassing whole neighborhoods, kicking in doors with no warrants, and occasionally murdering people.  We would have construction workers and farm laborers.  Prices would not be jacked up from arbitrary new taxes.  Trade agreements would be negotiated for US benefit, and not for extortion and bribes. 

I could go on for pages but I’ll stop here.  All these bad things were predicted before people started voting for Biden’s successor.  

What was so wrong with peace and prosperity?  Why did folks vote for this maddness?",comment,1s7onfp,t1_odb019a
guttanzer,26,117,1774886496.0,-0.9859827160835266,"... and the vast majority over 60.   

This isn't a boomer war; this is a Trump/Israel/Russia war.  Let's not divide ourselves along the wrong lines. ",comment,1s7qduv,t3_1s7qduv
guttanzer,26,124,1774914156.0,-0.5187286138534546,"And yet, this is probably the best move he could make.  

So it isn’t what he is going to do.  He’s running the wrong way, but he’s going for legendary so he’s going to keep going for the wrong goal.  He might even kick the extra point for the other team.",comment,1s84pf4,t1_ode5gwb
Wonderful-Pause1048,27,44,1774626372.0,0.6593257188796997,"Oh, that would be amazing! Then Iran would have endless leverage over Trump",comment,1s57brt,t1_ocseanw
Wonderful-Pause1048,27,108,1774855935.0,-0.9968773126602173,when education is lacking,comment,1s7alv4,t1_od9lnbv
Due_Bluebird3562,28,71,1774721982.0,-0.9825779795646667,"&gt;The US military actually doesn't have the number of active army troops needed to occupy Iran, so if Trump wants it..

&gt;Ready to get drafted and die for your pedo emperor yet?

Only about 24-25% of Gen Z men are fit enough under current physical requirements to even be drafted. That's probably the reason for the recent age update. Though even with a draft Iran is basically a fortress. No amount of regular manpower is keeping Iran controlled for more than a few weeks at best. 

 Bit of a tangent but imagine if Iran was six times larger geographically, has roughly four times the population, and almost every adult is capable or expected to own a firearm. Now you start to see why the idea of martial law doesn't work here when our military really only makes up about a 1% of the population. A decent chunk of which are stationed abroad. 
",comment,1s64qid,t1_ocz9nsr
Due_Bluebird3562,28,116,1774885692.0,-0.984329342842102,"&gt;Trump doesn’t strategize. Truly, he just reacts to things. He knows his time on the planet is coming to an end and he sure as hell doesn’t care about what happens to the rest of us. 

This is true. It's arguably what makes him such a dangerous individual. He's not some genius with some grand plan. He's just incredibly stupid. So stupid, in fact, that I doubt he has the actual codes to the nukes anyway. Just like Reagan later in his term. ",comment,1s7alv4,t1_od9ebqg
Due_Bluebird3562,28,124,1774910990.0,0.9726715087890625,Russia absolutely played a role in his rise. I agree America is ultimately responsible for Trump but let's not play stupid here. Russia has been Trump's ally from day one. He even has a fucking codename. ,comment,1s855yl,t1_odedq9v
Due_Bluebird3562,28,124,1774914319.0,-0.9847389459609985,"It's pretty obvious that Trump isn't a believer. The man couldn't even be bothered to put his hand on a Bible.

&gt; Why would you bring atheism up at all if not to imply that atheists at large don’t care about the world?

What a massive logical leap. I stated that narcissists rarely believe in religion. They may appear to do so to the masses but that's largely a con. It has nothing to do with the majority of atheists. Hell in my experience atheists are typically morally superior to their religious counterparts in every way. 

If anything the takeaway is that religion is a tool that people like Trump use to get what they want. They're not actually buying that shit. 

",comment,1s855yl,t1_odeodci
SodaCanBob,29,92,1774796691.0,-0.9991304278373718,"&gt;it all started ~~at a Whitehouse correspondence dinner....~~ 

with failing to hold the Confederate leadership accountable.",comment,1s6x4wq,t1_od53d3n
SodaCanBob,29,93,1774799852.0,-0.9950757622718811,"&gt; he actually floated a run back in in 2000. 

Oprah was asking him if he ever planned to run as early as 1988.",comment,1s6x4wq,t1_od5flcs
SodaCanBob,29,93,1774800906.0,-0.995357096195221,"&gt; But we have ignored too many red flags. We saw Trump once and didnt do anything to close up the rat-holes he got in through. 

We didn't hold the Confederates accountable, we ignored the business plot, FDR (as good as he was) probably wouldn't have been punished for imprisoning Japanese Americans, we didn't punish McCarthy for eroding our 1st Amendment rights, Nixon was pardoned, Trump was behind 1/6, raped kids, and has 34 felonies and was rewarded with the White House again, the list goes and on. 

America should never be taken seriously again unless it actually shows that it's willing to hold its rich and powerful accountable for their actions because it's consistently shown that it's not willing to do that.",comment,1s6slez,t1_od4i5wh
SodaCanBob,29,104,1774840036.0,0.9981186985969543,Marianne Williamson's [healing crystals are sounding pretty good right about now](https://reason.com/2019/08/21/marianne-williamson-wants-to-defeat-dark-psychic-forces-with-new-department-of-peace/).,comment,1s7ce7w,t1_od8ig1p
SodaCanBob,29,112,1774869366.0,-0.9013479351997375,Even Satan would be impressed by how demonic the GOP can be.,comment,1s7na76,t3_1s7na76
SodaCanBob,29,114,1774877022.0,-0.9977363348007202,"&gt; He’s not even giving his lies time to set. Every fifteen minutes he’s flipping back and forth between claiming Iran is on their last legs and begging to surrender and claiming they’re not negotiating seriously and he’s going to destroy them if they remain defiant. 

Dementia Don might have a hard time remembering what he said 15 minutes ago.",comment,1s7onfp,t1_odav58j
cycling-expat,30,115,1774879363.0,-0.9940025210380554,"We need more good references like this. I throw out some Adorno, Gramsci, and Habermas at times and only get confused responses. ",comment,1s7qvw9,t1_odb78bk
cycling-expat,30,128,1774925345.0,-0.9981576800346375,The left is their own enemy in the purity test stuff. It drives me crazy on so many issues. The only candidate many I talk to on the left they would support it themselves. That is the only person that will agree with them enough. ,comment,1s7qvw9,t1_oddpyzd
ArrowsOfFate,31,43,1774621333.0,-0.997974693775177,"If all they can think of is in symmetrical terms and fail to realize the power of an asymmetrical enemy then yeah, America looks hella bad ass and completely unstoppable. 

Defeating the main army is only part of a modern war though. Trying to defeat the insurgency after the main army is beaten is a task America has not been capable of achieving with any degree of certainty at all.  Killing a bunch of sons, daughters, mothers, fathers, husbands, wives, uncles, aunts, grandfathers, grandmothers and so on tends to do that. The more we try the more enemies we create.",comment,1s54b1p,t1_ocrynrw
ArrowsOfFate,31,44,1774625847.0,-0.6780893802642822,Hehe 😜 ,comment,1s54b1p,t1_ocsflfv
ArrowsOfFate,31,55,1774663240.0,0.9966287016868591,Les miserables is trumps favorite play. It wouldn’t have any effect on a tunnel vision outlook of the world. ,comment,1s5lija,t1_ocvo0rc
pymjohnil,32,96,1774811227.0,-0.9993313550949097,It’s not that simple. If the US pulls out now it strengthens Iran and their allies. Which is ultimately bad for the US. ,comment,1s6znum,t1_od5p2h7
pymjohnil,32,96,1774811988.0,-0.9906891584396362,"I’m just pointing out that it’s not so simple. Has Iran not contributed to ruining the stability of the world? Or their allies and proxies? 

I’m Canadian too. IMO it was an inevitability that at some point we’d have to snap out of our naive worldview that we could just rely on our geography and the US, while at the same time de-industrializing in the name of saving 2% of global emissions. 

We’ve been stupid. Maybe we need to smarten up. The world is a dangerous place and we’re just realizing that it seems.",comment,1s6znum,t1_od6k43f
pymjohnil,32,97,1774816073.0,-0.9984152317047119,"The diplomatic plan was working? Past weak US/UN policy that allowed Iran a pathway to Nukes? 

I guess we’ll see how this plays out then. Seems to me like they pounced on a weakened Iran coupled with the White House, Senate and House and decided to strike before Iran was able to build up enough of a missile deterrent to realize their nuclear ambitions. 

Does that make it not an absolute shit show? No.",comment,1s6znum,t1_od6v9q0
pymjohnil,32,112,1774869726.0,-0.9870827198028564,"Ya, that’s why I put the West. Because that’s who I am talking about ",comment,1s6znum,t1_od9zhg0
pymjohnil,32,118,1774889795.0,-0.9805099964141846,"So you say you don’t believe Trump - but then you believe Trump. Hilarious. 

Obama criticized the withdrawal from the JCPOA, basically saying Trump gave the world a losing choice between a nuclear armed Iran and War in the Mjddle East (paraphrasing). Even he knew the regime had nuclear ambitions and was working towards them. Why else would they have stockpiled enough Uranium at 60% (easy to get to 90%) to make potentially 9 nuclear bombs? 

And US intelligence services have also said that Iran was working on ICBMs capable of reaching the USA by the mid-2030’s. 

Sorry, your common sense doesn’t cut it for me. This conflict was inevitable. Islamofascists who slaughter 10’s of thousands of their own civilians in the streets, fund terrorism around the world and destabilize the Middle East were never going to be allowed to get close to a Nuclear weapon. And I believe they were working towards first having such a massive missile capability that would serve as a deterrent for them to continue down that path unchallenged. ",comment,1s6znum,t1_odc6rrk
SpaceElevatorMusic,33,21,1774542946.0,-0.6377203464508057,"Republicans launch new party-line bill for ICE, Iran war funding and election laws | With Trump's support, top Senate Republicans announced they'll pursue a big new filibuster-proof bill without any Democratic votes — and try to add elements of the SAVE America Act.",post,1s4cilf,
SpaceElevatorMusic,33,43,1774622396.0,0.9899657964706421,"""~~Russia~~ Iran, if you're listening...""",comment,1s55u7p,t3_1s55u7p
