user,user_idx,time_bin,timestamp,sentiment,text,type,post_id,parent_id
SpaceElevatorMusic,33,68,1774709686.0,-0.9874060750007629,"Insider trading concerns around the Iran war are on the rise. Can anyone police the bets? | So far, no American has faced federal charges related to insider trading on event-driven news. But accusations about questionable trades are mounting.",post,1s62hkv,
SpaceElevatorMusic,33,89,1774787858.0,-0.9978413581848145,"Russia took satellite images of U.S. air base in days before Iranian attack, Ukraine's Zelenskyy says | Volodymyr Zelenskyy told NBC News it would be a ""mistake"" if American-made missile interceptors bound for Ukraine were diverted to Gulf countries being attacked by Iran.",post,1s6tz0g,
SpaceElevatorMusic,33,90,1774790828.0,-0.9889727234840393,No end to war in sight after one month as Iran squeezes global economy | The world is now facing price increases and perhaps even shortages for energy and food that are already baked in — and that’s if the conflict ended tomorrow.,post,1s6v2qf,
SpaceElevatorMusic,33,114,1774876910.0,-0.9295542240142822,Trump issues new threat to Iran's civilian infrastructure if a ceasefire isn't reached 'shortly',post,1s7qfjg,
Zomunieo,34,4,1774482404.0,-0.9870567321777344,Maybe they could offer him the Hormuz Peace Prize made of highly enriched uranium. ,comment,1s3pt2b,t1_ochin26
Zomunieo,34,52,1774653752.0,-0.9992884397506714,King Joffrey is tired. Send him to bed with some milk of the poppy. ,comment,1s5fg9h,t1_ocu7nqs
Zomunieo,34,67,1774709003.0,-0.9661385416984558,“like” he’s crazy?,comment,1s60ngn,t1_ocykfvc
Zomunieo,34,67,1774709159.0,0.9532856941223145,"Why money? To avoid or delay invasion. It makes sense. 

Iran’s revenge will come years after this over. That’s just what makes sense strategically. ",comment,1s60ngn,t1_ocymb37
Zomunieo,34,79,1774749635.0,-0.9961470365524292,I guess there were unknown unknowns. ,comment,1s6gxhz,t1_od27q68
Zomunieo,34,115,1774881662.0,0.9954127669334412,They also have the free time. ,comment,1s7qduv,t1_odbb0pd
Werftflammen,35,17,1774526249.0,0.9880351424217224,"Those who are still clapping for Trump are not only drinking the Koolaid, they have shares in it.",comment,1s3vwj2,t3_1s3vwj2
Werftflammen,35,53,1774655480.0,-0.9726895689964294,"Don't worry, he is just humiliating the US army. He is sending them there Iran 'caves' and bith parties eclare victory.",comment,1s5goo6,t3_1s5goo6
Werftflammen,35,53,1774656251.0,-0.9723984003067017,This is just from keeping Iran to invade the GCCs,comment,1s5gv06,t1_ocuglk1
Werftflammen,35,82,1774761791.0,-0.9738962650299072,Accomplished? Have you menstioned the Epstein files?,comment,1s6gxhz,t1_od1vxok
Werftflammen,35,83,1774766670.0,-0.9967060685157776,This performative bullshit is killing the US. This apathy. Trump bullshits you and you wondering is bullshit too. This is happening because your country is run by a criminal troll.,comment,1s6i85r,t1_od24n0g
Werftflammen,35,105,1774845535.0,-0.9981354475021362,"They are culpable, willfully ignorant because racism. Their other points are fake, just to justify it to themselves.",comment,1s7chln,t1_od95b5g
Werftflammen,35,110,1774862633.0,-0.9906863570213318,I didn't realise shooting up school was such a cultural thing?,comment,1s7alv4,t1_od80rc4
mike-deadmonton,36,101,1774831615.0,-0.9997128844261169,"Best description I heard, ""comic book stupid""",comment,1s7alv4,t3_1s7alv4
mike-deadmonton,36,102,1774835048.0,-0.9994693398475647,"At one time it was that simple. In Ontario, drilled 150 feet, but could not control production, guess it left several feet of oil all over for miles. Cheap oil is gone though, dig up bitumen or use convoluted drilling to pull out of shale. Or crazier, try diplomacy with low cost Gulf countries ",comment,1s7ce7w,t1_od8ee35
mike-deadmonton,36,122,1774906745.0,-0.9822308421134949,"After witnessing Pete Hegseth, you can't use serious and military in same sentence ",comment,1s7ce7w,t1_oddhrb3
mike-deadmonton,36,123,1774910302.0,-0.9935871362686157,"Glad NATO said they are a defensive organization, don't support members undeclared wars. USA has the gall to declare ineffective, but only time NATO utilized was 911. USA is currently led by dementia, stay away ",comment,1s84pf4,t1_ode93yz
mike-deadmonton,36,123,1774910488.0,-0.9957467913627625,"Even dumb people will take advice, Dementia Don appointed fools in cabinet. Fascist regime needs functional military to pay for excess, but the incompetence....",comment,1s84pf4,t1_ode65v2
Ok-disaster2022,37,53,1774658737.0,-0.9860971570014954,"The POW flag is gonna make a come back in a big way because of the number of POWs Iran is going to have. 


This is going to be like Black hawk down x2000. The US is not prepared for war with Iran. The US military has spent like the last 5+ years restructuring to fight an island hopping campaign in the East Vietnam Sea or in Europe  ",comment,1s5gv06,t1_ocuyzgj
Ok-disaster2022,37,68,1774711652.0,-0.9997888207435608,"Man imagine the strategic geniuses at the ""non woke"" ""department of war"" who decided they could attack a smaller nation with a much weaker military and a month in everyone is saying they have no way to win. 


Just pedo supporting morons losing to a regressive religious dictatorship. Just how bad are they. ",comment,1s60ngn,t3_1s60ngn
Ok-disaster2022,37,78,1774746979.0,-0.9917687177658081,"The US military is not ready for a sustained war. Since like 2015 military planners have been refocusing military goals to opposing Chinese and Russian expansionism. New aircraft, new trucks and tanks, new ships. the US military has t had such plan for overhauls since the late 90s and just like in the early 2000s a Republicans is sidetracking all of that planning to wage meaningless war in the desert. 


You wanna know why there has been a new fighter designed since the early 90s? It's because the budget for new designs was diverted to sustainment if a stupid meaningless war against poorly armed insurgents. Iran is not poorly armed insurgents. They're a modern country with a modernish military that has had decades of trade limitations. And they're still ticking. 


The US Israel bombing campaign has done nothing except harden the resolve of the Iranian people against the West and allow the Iranian dictatorship to crack down on any dissent. 


If the US attempts to invade thousands of troops will be killed and tens in f thousands more of Iranian civilians will die. US soldiers will be baby killers especially if IDF is brave enough to send troops in support ",comment,1s6gxhz,t3_1s6gxhz
Ok-disaster2022,37,94,1774802946.0,-0.999110996723175,"Any president is only as informed as the advisers around him. Most presidents try to find at least some people who will give them bad news and tell them what not to do. Republicans even managed to get some in the cabinet the first round. Pedo Trump 2 has filled his advisers with sycophants and full blown cultists. Not all of them are if the same cult so there's infighting between them but no one is pushing back on Pedo Trump. Its the dictator's trap. 


Intelligence is actually one of the places where politics matters less because whatever is said no one will typically make public for at least 20 years. But Pedo Trump as undermined the intelligence agencies so bad that he's getting bad Intel. (Not that American intelligence is actually any good, they easily fall for documentation and reports never thinking that systemic corruption makes such things almost useless for the defacto reason you're looking at it. ) ",comment,1s6wfpl,t1_od581wl
Ok-disaster2022,37,105,1774845489.0,-0.999001681804657,"The only way to secure ground is to have boots on the ground. you can bomb a place into a massive collection of craters, but if you don't have boots on the ground and a monopoly of violence you do not control the area. 


Why would the US need or want to secure ground in Iran? you would have to control thousands of square miles of coastline and adjoing area to secure the water way. Basically you'd have to defeat Iran. There's no defeating iran though. ",comment,1s7chln,t1_od8n59j
Ok-disaster2022,37,115,1774881269.0,-0.9887112379074097,"And left the bodies of fellow soldiers lying in the desert. Specifically agents the direct orders of President Carter. He knew it was high risk, but he told them if they couldn't achieve it they don't leave anyone behind. And they did anyway. 


The result of that failure resulted in the development of the various special forces today. ",comment,1s7q94h,t1_odbgsei
Ok-disaster2022,37,126,1774919634.0,-0.9893975257873535,Was thinking the same thing. ,comment,1s855yl,t1_odeak2h
Mysterious-Tie7039,38,44,1774626464.0,-0.9787909984588623,Yes and gave Iran more in oil purchases than Obama freed up in seized funds that Trumplicans lost their shit over. ,comment,1s54b1p,t1_ocsbr4k
Mysterious-Tie7039,38,46,1774633199.0,-0.9519787430763245,How bout dat,comment,1s57brt,t1_ocsu8zm
Mysterious-Tie7039,38,117,1774887573.0,-0.9992468357086182,"You forgot the best part:

Illegal war whose best possible outcome at this point would be for things to go back to exactly how they were before this started. ",comment,1s7ubwm,t1_odby6la
Mysterious-Tie7039,38,121,1774900604.0,-0.9786938428878784,Which is why I said “best possible outcome” and not “most likely outcome”. ,comment,1s7ubwm,t1_odd0sr0
Mysterious-Tie7039,38,124,1774912334.0,-0.9995129108428955,And killed servicemen &amp; women and wasted billions of dollars. ,comment,1s7ubwm,t1_oddq93n
RJ5R,39,3,1774477933.0,0.9992914199829102,the fact they even read up on the subject is already impressive for this administrations appointees. the guy that trump selected for fema didn't even know there was a hurricane season,comment,1s3js1s,t1_ocgmwf9
RJ5R,39,52,1774652788.0,-0.9404975771903992,"Everyone is pannicking

Except Linsdey Graham, who is itching for another Iwo Jima",comment,1s5goo6,t3_1s5goo6
RJ5R,39,53,1774657843.0,-0.9916084408760071,"well oil is just one thing that comes down that strait, one of many types of raw materials

including *raw materials that go into making fertilizer*, along with various raw materials for batteries

trump screws the farmers again and again and again (and yet they still voted for him 3x bc they thought they were owning the libs, but instead many will end up being the ones getting owned... losing their family farms in the process )",comment,1s5lija,t1_ocvf6dh
RJ5R,39,65,1774699226.0,0.9997722506523132,We will see how well that holds after all of this ,comment,1s5ni72,t1_ocwgoon
RJ5R,39,79,1774750030.0,-0.9614556431770325,"Who remembers *""just a little excursion""*  ?",comment,1s6i85r,t3_1s6i85r
Catspaw129,40,0,1774465483.0,-0.9990160465240479,Was there a plan and the dog ate it? Or was it only just a concept of aplan?,comment,1s3js1s,t3_1s3js1s
Catspaw129,40,50,1774646840.0,-0.9996185302734375,"I guess they've gotten to the point that they are re-running those clip shows of things blowing up for him so often that even someone with dementia says ""Hey! I've seen this before.  A few times.""",comment,1s5fg9h,t3_1s5fg9h
Catspaw129,40,72,1774725850.0,-0.9959167838096619,Maybe he's just keeping his options open?,comment,1s60ngn,t1_ocynlhf
Catspaw129,40,118,1774889346.0,0.9921039342880249,"That makes perfect economic sense.

According to google, a laser guided bomb costs $22,000 to $55,000 (of course, that doesn't include the delivery fee and the facility fee)

That's about the same cost as a visit to the emergency room to remove a splinter. 

Plus, with a bomb you can ""treat"" multiple people for the same low price.

Fiscal conservatism: it works!",comment,1s7ubwm,t3_1s7ubwm
Catspaw129,40,120,1774899591.0,-0.9984230995178223,"This is what disturbs me about the markets.

Some ""event"" occurs and professional traders -- who ought to know better -- react; like chicken with their heads cut off.

And then all those algorithms kick in and magnify the effect (good or bad) of just a few hysterical investment ""pros"" and day traders hiding in their parent's basements.

so much for my rant.",comment,1s7xddx,t3_1s7xddx
Catspaw129,40,124,1774911648.0,-0.6735156178474426,"""*A ground invasion of Iran would be a huge mistake*""

That's a sound reason to do just that.  Am I right?",comment,1s855yl,t3_1s855yl
Avoidtolls,41,1,1774471475.0,-0.9996086955070496,Dementia as foreign policy. ,comment,1s3js1s,t3_1s3js1s
Avoidtolls,41,44,1774623110.0,-0.9991533756256104,Got to distract from putting tent stakes up the booty hole. ,comment,1s54b1p,t3_1s54b1p
Avoidtolls,41,45,1774627382.0,-0.9971550703048706,Fucking noob.,comment,1s55u7p,t3_1s55u7p
Avoidtolls,41,102,1774834973.0,0.998002827167511,That's the whole point. ,comment,1s7ce7w,t3_1s7ce7w
Avoidtolls,41,117,1774888104.0,0.8510650992393494,"Mexico has universal healthcare. 

Canada has universal healthcare. 

USA has a military that can't win wars and is used to make billionaires richer. ",comment,1s7ubwm,t3_1s7ubwm
Avoidtolls,41,120,1774896816.0,-0.9952782392501831,"Congress can stop this nightmare at any time.

Thy choose not to.",comment,1s7xddx,t3_1s7xddx
Broken-Digital-Clock,42,47,1774634624.0,0.9983479976654053,I never thought I'd be rooting for Iranian hackers. Another win for maga.,comment,1s5931o,t1_oct4dy6
Broken-Digital-Clock,42,50,1774647246.0,-0.9916338920593262,"Nah, there are still too many grifting opportunities. And most importantly, immunity from prosecution.",comment,1s5fg9h,t1_ocu82y1
Broken-Digital-Clock,42,53,1774656480.0,-0.9953358769416809,I'd prefer to see a coalition of Israel and ICE invade.,comment,1s5gv06,t1_ocusi03
Broken-Digital-Clock,42,106,1774847252.0,-0.9705900549888611,When did Rage get political and woke!!?? 😡🤡,comment,1s7chln,t1_od8w5qb
Broken-Digital-Clock,42,120,1774896553.0,-0.975774347782135,The Ellisons and their propaganda network,comment,1s7xddx,t1_odcnbcu
blackmobius,43,29,1774569703.0,-0.9962487816810608,"He is correct. He wont be paying for high gas or his own food or plane tickets as he flies around the country every other day.

Those costs fall to the suckers and losers",comment,1s4i7kr,t3_1s4i7kr
blackmobius,43,51,1774651498.0,-0.9988403916358948,"They had, and still have, the opportunity to remove those troops or him, by invoking the checks and balances they refuse to acknowledge.

If they wont do their job then they can shut the fuck up already",comment,1s5goo6,t3_1s5goo6
blackmobius,43,56,1774667529.0,0.9759097695350647,Maybe we need to start sending some of the people cheering for this shit too. Bannon and Graham would be a great start,comment,1s5ni72,t3_1s5ni72
blackmobius,43,71,1774720692.0,-0.9962777495384216,"They should be upset. Hes made it harder to get the opportunity to make their lives better, made it harder to exist, and saddled them with bills they can never hope to repay.

But theyll get over it cause trump also makes lgbt people mad and thats all the maga ever really wanted",comment,1s64qid,t3_1s64qid
blackmobius,43,90,1774790968.0,-0.9832216501235962,"Its only gotten started.

Thousands of Marines massing in the waters around Iran arent there for a picnic",comment,1s6slez,t3_1s6slez
blackmobius,43,97,1774815896.0,0.9979921579360962,"Its just astounding how its taken a little over four months to go from “peacetime president” that would never do something like this, to “we are about to commit to a ground invasion in Iran” with Maga just as seamlessly moving from one ideological extreme to the other.",comment,1s72ro9,t3_1s72ro9
Chemical-Fault-7331,44,23,1774548973.0,-0.9977929592132568,Wait for gas to hit $7 per gallon. I wound the surprised if it gets to 80% disapprove.,comment,1s4b1iz,t3_1s4b1iz
Chemical-Fault-7331,44,27,1774565072.0,-0.9184752702713013,"If I had to guess, I would say the he only has a few more percentage points worth of voters to lose (due to the economy getting really shitty and gas hitting $6-$7 / gallon) before we hit the floor of people that will never abandon him, never change their minds on him, etc.

This is basically it for this country. There is roughly a third of eligible voters that are just all in on this fascist white grievance.",comment,1s4b1iz,t3_1s4b1iz
Chemical-Fault-7331,44,51,1774650751.0,-0.9996151924133301,"I don’t mean to paint with broad strokes here, but when you have a legislative body where the majority do not have military service, they simply will not care about the loss of military life. So may congressman just don’t care.",comment,1s5goo6,t1_ocufbhw
Chemical-Fault-7331,44,54,1774661769.0,0.6881675124168396,They should just get rid of the VA at this point.  Don’t gaslight the troops anymore when they are getting out about an agency that will support them. Just tell them “yeah you’re on your own”,comment,1s5gv06,t1_ocuthqm
Chemical-Fault-7331,44,95,1774808646.0,-0.9988377690315247,"I think if this were to happen, Congress would collapse. Every single Republican rep would start resigning en masse out of literal shame. When your constituents are coming to you with footage of their sons and daughters being slaughtered from drones, from a war your party started, that can’t be easily shrugged off. You’d literally start seeing their constituents going after their families and homes. Reps would have to be evacuated to military installations. And I’m not sure how effective that would even be if it’s the same military whose members are being slaughtered.",comment,1s6znum,t1_od67fzw
Chemical-Fault-7331,44,123,1774909038.0,-0.9997146725654602,I think eventually we will start to see the public at large just lose trust in the system and people stop paying taxes.,comment,1s7zhwz,t1_odddfif
Prior_Coyote_4376,45,53,1774657387.0,-0.9952754974365234,It almost makes you wish we had more energy sources that weren’t dependent on foreign oil ,comment,1s5lija,t3_1s5lija
Prior_Coyote_4376,45,92,1774795963.0,0.656161367893219,"Republicans pushed America into the Iraq War and then the Iran War because their Christian supremacy took them into holy wars against the Middle East

I refuse to engage any Republican in a conversation until they can justify their party’s religious holy wars that seem only to further the interests of the Epstein class

They keep voting for death, rape, and pedophilia. Again and again and again. Sometimes their candidates get MORE popular when accused of pedophilia (looking at you, Roy Moore). I have no obligation to see anyone who does that as a fully developed human capable of independent thought.",comment,1s6wfpl,t1_od4zta8
Prior_Coyote_4376,45,117,1774886165.0,-0.9869231581687927,"Universal care (health care, child care, elder care) 

Universal housing 

Universal income 

A New Deal Democrat who wants to see us survive through Reconstruction 2028 must acknowledge that wealth in America has been hoarded by a few powerful pedophiles who have spent the GDP of small countries on convincing us we can’t achieve these safety nets. 

If anyone asks how we pay for it, we say no more forever wars, no more corporate welfare, and no more Trump tax cuts for the Epstein class. That’s where the waste, fraud, and abuse are after all.",comment,1s7ubwm,t3_1s7ubwm
Prior_Coyote_4376,45,118,1774892701.0,-0.996649444103241,"Democrats really need to start making it clear that one of the biggest weapons for Reconstruction 2028 is going to be civil forfeiture against the Trump crime family and anyone who did business with them.

Yes, we can just take your stuff from the mouths of your children and put you in the timeout box for 100 consecutive life sentences if you break the rules. Behave and it won’t happen.

SpaceX? Nationalize it under NASA. 

Palantir? Instantly dissolved.

Who’s next? We don’t have to stop at tech bros.

EDIT: 

CoreCivic! Our friends in the private prison industry funding the ICE concentration camps AND prisons worldwide. They’ve made a lot of money, and it would be great if we could nationalize those prisons and give these friends a turn experiencing their own very profitable services. For free!",comment,1s7xddx,t3_1s7xddx
Prior_Coyote_4376,45,128,1774926612.0,-0.6897206902503967,"I like that idea. Democrats really should embrace the idea of stimulating entrepreneurship and small businesses by creating shared infrastructure for those looking to enter the marketplace and a strong safety net for those who take risks that didn’t pan out. 

We need to defeat this idea that big businesses are synonymous with growth. It’s the exact opposite. Once a business grows big enough, it can embed itself into political systems and become anti-competitive to the point of excluding new entrants. At that point the government should treat it as a public utility that’s part of the national infrastructure.  ",comment,1s7xddx,t1_odcz5j3
timnphilly,46,44,1774626261.0,-0.9983722567558289,"Democrats should be saying that! Not our Congressional Democrats, of course 😏",comment,1s56t47,t1_ocsd9tl
timnphilly,46,97,1774815261.0,0.9998631477355957,Agent Krasnov is making his master Putin very proud.,comment,1s72ro9,t3_1s72ro9
timnphilly,46,113,1774873021.0,-0.9944593906402588,"People believe their lies and vote for them - just as with Trump.

Might as well be an official death cult.",comment,1s7na76,t1_odahmis
timnphilly,46,116,1774884255.0,-0.9996174573898315,And he's going to intentionally drag this out to hijack our midterms - lest anyone be surprised.,comment,1s7alv4,t1_od84vg9
timnphilly,46,117,1774886561.0,-0.728090226650238,100X this \^,comment,1s7ubwm,t1_odbz6ft
timnphilly,46,119,1774894575.0,-0.9989280104637146,"Someone posted this diagram how every Monday over the last month (Iran war) have gotten a market bump - probably rigged: 

[Monday market bumps](https://www.reddit.com/r/FluentInFinance/s/cPTOXb9hFI)",comment,1s7xddx,t3_1s7xddx
reddittorbrigade,47,44,1774625156.0,0.997978150844574,"Iran, if you are listening. Please release the Epstein files proving Trump raping those innocent kids .

It is more powerful than a nuclear bomb.

",comment,1s56t47,t3_1s56t47
reddittorbrigade,47,50,1774646905.0,-0.9994801878929138,"The incompetency of Trump government will result into deaths of our troops.

If Kamala was our president, we wouldn't be in this war. Our lives would have been in better situation.

Trump had scrapped the  Iran deal so we could start a war.",comment,1s5gv06,t3_1s5gv06
reddittorbrigade,47,100,1774825567.0,-0.5821790099143982,"For every American soldier dying of Trump's war, all Trump voters are responsible for it too.

",comment,1s79w5y,t3_1s79w5y
reddittorbrigade,47,117,1774885846.0,-0.9990513920783997,"A lot of Americans are homeless too because our tax payers money is being diverted to Trump's Epstein War.

The longer we allow Trump to stay in power, the more we suffer.",comment,1s7ubwm,t3_1s7ubwm
reddittorbrigade,47,119,1774893122.0,-0.9965981841087341,"I want this old man be charged after his term.

",comment,1s7xddx,t3_1s7xddx
reddittorbrigade,47,121,1774900190.0,-0.9541475772857666,"Donald Trump is a terrorist and war criminal.

\#FACT

",comment,1s814g7,t3_1s814g7
reddittorbrigade,47,123,1774909161.0,-0.9887672066688538,Trump is a terrorist. His goal is to destroy our country and help Russia.,comment,1s855yl,t3_1s855yl
Dirkdeking,48,43,1774620446.0,-0.8948772549629211," This is a 50-50 for Russia. It helps them but simultaneously goes against their interest as well. Iran is a major Russian ally that provided them with drones, and gives them a foot in the door in the middle east. 

 The higher oil prices are nice, but if the Iranian regime where to seriously weaken or even worse fall, then Russia will be in a worse situation.",comment,1s54b1p,t1_ocrt5k6
Dirkdeking,48,43,1774621407.0,-0.998369038105011, Russia can never directly help it's ally if the US is directly involved. But in the past at least they would be much more pro active in arming Iran and trying to find a diplomatic solution. Like they did with Syria following Obama's red line moment. Now they can't even do that anymore.,comment,1s54b1p,t1_ocrzn7p
Dirkdeking,48,44,1774625272.0,-0.9953688979148865," Completely depends on if the regime survives it. The only way they go down is with a full Iraq style ground invasion, or a revolution much larger than even the one in January. 

 So the most likely outcome is that they tank this war and embarass the US in the process.",comment,1s54b1p,t1_ocsbrf9
Dirkdeking,48,115,1774880473.0,-0.9958804845809937," The most important principle should be that you don't escalate a previously stable situation. Starting a war should always be a REACTION to what another country does. 

 That can be because they attack you, because they attack another country, or because they start a genocide against an ethnic or religious group in their own territory. In 1990 the war was a reaction to an invasion. Serbia was a reaction to a genocide. But Iraq in 2003 war was an unnecessary escalation of a stable status quo. ",comment,1s7qduv,t1_odba80u
MourningRIF,49,43,1774622903.0,-0.9994931221008301,"So each guy only has to take out 10 of theirs.., how hard could it be?  /s",comment,1s54b1p,t1_ocrsi71
MourningRIF,49,44,1774625796.0,-0.999396562576294,Math is hard.,comment,1s54b1p,t1_ocs6hwg
MourningRIF,49,54,1774661323.0,0.9989101886749268,We have Bill &amp; Ted in charge of the country.,comment,1s5lija,t3_1s5lija
MourningRIF,49,59,1774679872.0,0.9983239769935608,Then send them to Iran and see if they still think it's cool.,comment,1s5ni72,t1_ocwgoon
MourningRIF,49,92,1774797218.0,0.9993403553962708,"It's not his boots, so he's fine with it.",comment,1s6x4wq,t3_1s6x4wq
MourningRIF,49,102,1774835207.0,-0.9964522123336792,Just take it huh?  Who is gonna pump it out of the ground while they get shot at?,comment,1s7ce7w,t3_1s7ce7w
