user,user_idx,time_bin,timestamp,sentiment,text,type,post_id,parent_id
XSinTrick6666,0,4,1774479907.0,-0.9924537539482117,"Probably Kushner broke him off his cut of oil profits, trading ahead of TACO's Retreat.

I mean Kushner and Witkoff are the only 2 who can ""see"" Trump's invisible Iranian Leader...",comment,1s3pt2b,t1_och8yde
XSinTrick6666,0,25,1774556881.0,0.9910308122634888,He's made $6BN since taking office.  Why should he care?  Best reality TV gig he ever had...,comment,1s4i7kr,t1_ocn9xw8
XSinTrick6666,0,46,1774632515.0,-0.998591959476471,"o snap

this is Signal-Chat scandal level .. but worse .. during war time",comment,1s5931o,t1_ocss6h2
XSinTrick6666,0,48,1774640034.0,-0.9980126619338989,It would STILL be news if it was Hillary Clinton's email that was breached ...!,comment,1s5931o,t1_octkx1u
XSinTrick6666,0,67,1774706667.0,0.9961596727371216,"Don’t forget his Big Oil masters … War Profiteeris is why he keeps extending ‘talks’ w non-existent Iranian negotiator

Trump Admin has been steady: Telling US and World to drop clean energy, EV, and Wind projects",comment,1s60ngn,t1_ocyd4w4
XSinTrick6666,0,78,1774746274.0,-0.9606090784072876,"Epstein's PR Agent and fellow-criminal

BURP",comment,1s5ni72,t3_1s5ni72
XSinTrick6666,0,90,1774789210.0,-0.9959031939506531,"I think the world can clearly see the MAGA vote flushed this country all the way down the toilet.

But we have ignored too many red flags.  We saw Trump once and didnt do anything to close up the rat-holes he got in through.  We flouted international Rule of Law.

The 'slippery slope' concepts appear to be too subtle for Americans.  They have to see us - see their own predicament - literally sliding into a deep chit hole",comment,1s6slez,t1_od4ggvr
XSinTrick6666,0,113,1774874769.0,-0.985637366771698,"Actually even US Oil execs - who are making a bundle - have warned that the commodity market has oil way underpriced.

This is market manipulation clear and simple.  You can be sure the US Govt is interceding in the Chicago market.  But traders gonna trade ... they make any excuse to follow the leader to more abundant profits...  Index options are trading at record levels

[https://www.reuters.com/business/energy/exchanges-oppose-potential-us-treasury-intervention-oil-futures-market-2026-03-12/](https://www.reuters.com/business/energy/exchanges-oppose-potential-us-treasury-intervention-oil-futures-market-2026-03-12/)",comment,1s7onfp,t1_odaqg19
XSinTrick6666,0,114,1774875076.0,-0.9993765950202942,"Too late - bombing them, targeting schoolgirls, and assassinating leaders during negotiation - twice - was already a crime.",comment,1s7onfp,t1_odarbkn
XSinTrick6666,0,115,1774879994.0,-0.9997676014900208,Two losing outcomes: (1) they find  uranium and try to remove it without 'incident' or (2) they escavate bunker-busted site and it is empty,comment,1s7q94h,t1_odbbjpc
XSinTrick6666,0,117,1774885811.0,-0.9996137022972107,mental decline,comment,1s7q94h,t1_odbv490
Quadrenaro,1,100,1774826013.0,-0.9901532530784607,Its a paper tiger. Their primary weapon is terror and propaganda. ,comment,1s79w5y,t1_od7ti8p
Quadrenaro,1,101,1774829528.0,0.9968159794807434,Thats demonstrably different.,comment,1s79w5y,t1_od84uox
Quadrenaro,1,102,1774835010.0,-0.9127635359764099,"Well I'm talking more literally. Iraq had a large, and what considered for the time, good, army in 1990. Iran has far less in both weapons and manpower as of 2025. Funny enough, I've written a couple of those history books you might be citing, atleast if its in English. ",comment,1s79w5y,t1_od81rgr
Quadrenaro,1,103,1774836262.0,-0.6001241207122803,"No, they have weapons of war. Iran supports the russian war of aggression against Ukraine. Iranian weapons are keeping the russian army going, and fuels terrorism against a sovereign European nation.


Hey I got a serious question. Do you denounce the terrorist state of Russia, and its allies that support them? This is more or less a b0t-ch3ck question. Its honestly been a really good filtration tactic.",comment,1s79w5y,t1_od8lvuc
Quadrenaro,1,109,1774859722.0,-0.978980541229248,"Well thats not exactly what I meant. I was pointing out what the US did with tech that was 70s-80s. We are now running alot of new stuff following flthe future weapons programs in response to intel gathered from the ukraine war.


The US is at the hight of its power, and this war is looking like it is going to be conventional.",comment,1s79w5y,t1_od9zqov
Quadrenaro,1,111,1774864873.0,-0.9972000122070312,"Well... they really arent. The Iranian military uses old nazi tactics to seem bigger and better than they actually are. Which is to supress civil unrest. There's a reason Iran machine gunned 30,000 civilians last month, and it wasn't because they are strong. The nazis did the same thing, and when they were so high on their own farts, they went to war with nations who outnumbered them nearly 100/1.


People said the same thing about sadam in 1990. I mean nearly word for word ",comment,1s79w5y,t1_oda8odn
Quadrenaro,1,112,1774870189.0,-0.9829828143119812,"Germany wasn't a paper tiger. They just punched way above their weight by attacking the west. 


If iran goes asymmetrical, that means we'll be fighting russian backed terrorist and drawing fire and resources away from Ukraine.


The Iranian government historically been the primary exporter of Middle Eastern religious extremist violence. Unless Russia steps into those shoes, there this hydra will have no more heads.",comment,1s79w5y,t1_odak740
hypothethical,2,50,1774645998.0,-0.9895171523094177,"Iran war rages on heading into fifth week, as Trump maintains that U.S. has 'already won'",post,1s5gtsb,
hypothethical,2,114,1774878004.0,-0.9583215117454529,"Most American Jews disapprove of US military action against Iran, new poll shows",post,1s7qvw9,
hypothethical,2,115,1774879002.0,-0.92259281873703,"Very much a longer uphill climb, but 40% of American Jews as of last year said Israel was committing genocide, and a majority said Israel was committing war crimes and supported an arms embargo. I'm assuming both numbers have only gone up in recent months, it's no longer unpopular even in the Jewish community to be more opposed to Israel. 

The biggest problem is that even if 90% of American Jews hated Israel, you'd still have the billionaires who profit from war/genocide/oil. And they call the shots above all. ",comment,1s7qvw9,t1_odb8n2o
hypothethical,2,116,1774883128.0,0.9910237789154053,"""Way too strong"" for repeating what all major human rights groups are saying. I'm not anti-any people, I'm anti-apartheid and anti-genocide",comment,1s7qvw9,t1_odbnosh
hypothethical,2,121,1774900218.0,0.9588750600814819,"He's fine with destroying American infrastructure, I'm not surprised he has no misgivings about bombing another country's as well. There is no prison sentence long enough for his crimes ",comment,1s814g7,t1_odddmtu
hypothethical,2,125,1774916363.0,0.5017255544662476,Only some billionaires and Trump's inner circle ,comment,1s7qvw9,t1_odetbiy
hypothethical,2,127,1774924979.0,-0.9987421631813049,"Not true, 40% as of last year said Israel was committing genocide and a majority said Israel was committing war crimes and that there should be an arms embargo. Zionist propaganda makes it seem like Jews are a monolith",comment,1s7qvw9,t1_odffelq
ExtinctLikeNdiaye,3,20,1774539727.0,-0.9058727622032166,Fox News Poll: Trump Handling of Iran War: 36% Approve; 64% Disapprove,post,1s4b1iz,
ExtinctLikeNdiaye,3,22,1774544282.0,-0.9990919828414917,"What happened in 2024 is that we put forward a candidate who couldn't even remotely articulate her campaign message despite being given MULTIPLE high profile platforms to do so. 

She was more interested in ""brat girl summer"" and media campaigns than addressing pocket book issues with clearly articulated policies. 

The Democrats, as a whole, suck at winning elections. Its hard to blame the media after they've outspent their opponents on media and ad campaigns election cycle after election cycle. 

At this point, they can't even blame Citizens United given how much they've outraised and outspent Republicans. 

The issue isn't ""the media."" The issue is that the Democratic Party establishment and its various ""strategists"" are more about making $$$ from campaign media spend and consulting fees than they are about winning and governing. ",comment,1s4b1iz,t1_oclvbkl
ExtinctLikeNdiaye,3,23,1774549013.0,0.5372735857963562,Vietnam Special Operations Veteran... ,comment,1s4b1iz,t1_ocmaktz
ExtinctLikeNdiaye,3,42,1774617113.0,-0.9802306294441223,Facts have a liberal bias. ,comment,1s4b1iz,t1_ocnz43y
samueladams6,4,100,1774826269.0,-0.9971011281013489,"How many lives are you willing to spend to “prevail,” whatever the fuck that could possibly mean in this case?",comment,1s79w5y,t1_od7tu7y
samueladams6,4,101,1774829486.0,0.9993171691894531,"So You don’t support the war, you don’t know what the goals are. But you are sure we can win based off our stellar track record in places like Afghanistan…",comment,1s79w5y,t1_od83gej
samueladams6,4,103,1774835556.0,-0.9981406927108765,"And the US and Israel have only weapons of freedom I’m sure. 

You really think Iran hasn’t learned anything from watching how Ukraine defends itself?",comment,1s79w5y,t1_od8l7n2
samueladams6,4,103,1774837273.0,-0.975616455078125,And the difference between weapons of terror and war are? How is the US military not vulnerable to these terror weapons? ,comment,1s79w5y,t1_od8nsfc
samueladams6,4,123,1774908791.0,-0.9988216757774353,He is too senile and racist to have considered the consequences ,comment,1s84pf4,t1_ode5pbg
BigPapaJava,5,70,1774716780.0,-0.9930739402770996,The Confederacy of Dunces?,comment,1s5ni72,t1_ocxa0ck
BigPapaJava,5,71,1774723613.0,-0.9963777661323547,"That’s typically done to enable some very illegal, unethical, and unpopular shit, too…",comment,1s64qid,t1_oczc7t3
BigPapaJava,5,88,1774784687.0,-0.9484670758247375,"“Grab ‘em by the pussy,” indeed.",comment,1s64qid,t1_od2q63x
BigPapaJava,5,91,1774792549.0,-0.9863113760948181,Hasn’t he already declared victory at least a dozen times on iran?,comment,1s6slez,t1_od4if1e
Equivalent-Excuse-80,6,45,1774628240.0,-0.98455411195755,Ka$hMoney42069,comment,1s57brt,t1_ocsmxm9
Equivalent-Excuse-80,6,70,1774716766.0,-0.9932977557182312,The ambitions of ridding themselves the hassle of going through elections. ,comment,1s60ngn,t1_oczajrq
Equivalent-Excuse-80,6,115,1774880569.0,-0.9922139048576355,"Israeli Jews also disapprove of Netanyahu.

Only the loudest, most obnoxious people support wars; and that’s what gets reported on. Not the near constant large protests against an unpopular government.",comment,1s7qvw9,t1_odb7u26
Equivalent-Excuse-80,6,115,1774882110.0,-0.999481737613678,"Your little article here doesn’t give any data to prove anything. It only posits that some Jews **may** be leaning more right politically. But it doesn’t give any real examples or data to support this position. 

Odd that you would think this proves anything other than your alacrity to buy into your own preconceived biases. ",comment,1s7qvw9,t1_odbghvs
Equivalent-Excuse-80,6,117,1774886091.0,-0.9930399656295776,"What leads you to believe this?

Here is legitimate reporting that directly refutes your claims:

https://www.theguardian.com/world/2025/aug/18/netanyahu-criticises-protests-israel-handling-gaza-war-hostages

https://www.reuters.com/world/middle-east/israelis-stage-nationwide-protests-demand-end-gaza-war-release-hostages-2025-08-17/

https://www.democracynow.org/2025/8/18/israel_antiwar_protests

https://www.lemonde.fr/en/international/article/2025/08/09/thousands-protest-in-tel-aviv-against-the-israeli-government-s-move-to-expand-the-war-in-gaza_6744231_4.html

https://www.aljazeera.com/news/2025/8/17/israelis-hold-nationwide-protest-to-end-gaza-war-bring-back-the-hostages

It is quite telling that you would be more enthusiastic about believing misinformation about Jews than acknowledging the truth: Netanyahu and his Gaza war are very unpopular amongst Israelis.  ",comment,1s7qvw9,t1_odbodao
Equivalent-Excuse-80,6,126,1774919021.0,-0.9738768339157104,"They had almost 1 million protesting against Netanyahu’s Gaza land invasion. 

Israel only has a population of 7.3 million. 

Compare that to our last protests (somewhere between 8 and 9 million) and the narrative changes rapidly. 

Netanyahu and Hamas need to go. ",comment,1s7qvw9,t1_odc78ru
Equivalent-Excuse-80,6,127,1774923739.0,-0.988760769367218,"I’m not sophisticated enough to understand the parliamentary system that Israel uses. But I clearly remember a time when Netanyahu kept failing to build a coalition government and it caused 4 snap national elections in two years. 

(While I have my own issues with the American form of democracy, I appreciate multiple parties coalescing in a primary system in order to get an absolute majority. I guess with some parliamentary systems with 6 to 98 different parties, the winner may only get 36% of the vote. Which isolates the majority)

But my point stands, Netanyahu and the Likud are unpopular. 

&gt; Failure to approve the budget would have likely triggered a snap election within 90 days, which ​opinion polls so far have predicted Netanyahu would ​lose.

https://www.reuters.com/world/middle-east/israeli-parliament-approves-2026-state-budget-spokesperson-says-2026-03-29
",comment,1s7qvw9,t1_odfa9m2
ilevelconcrete,7,94,1774804105.0,-0.997464656829834,"Unfortunately, that’s not true. America still has a large collection of vassal states in Europe and Asia that have been quietly supporting the war effort, like the UK and France. ",comment,1s6znum,t1_od5mzng
ilevelconcrete,7,94,1774805059.0,-0.9926369190216064,"It’s not “theater”, Iranian civilians are dying by the hundreds daily",comment,1s6znum,t1_od5riie
ilevelconcrete,7,100,1774827102.0,-0.9869645237922668,"I don’t think you can deny there’s a lot of cognitive dissonance regarding American troops. People are willing to pay lip service to the idea of Iranian resistance to insult Trump, but at the same time, those same people also like to say the U.S. could defeat Iran “militarily” within a few weeks.",comment,1s79w5y,t1_od7ti8p
ilevelconcrete,7,102,1774831826.0,-0.9607797265052795,See what I mean folks??,comment,1s79w5y,t1_od8bdcr
ilevelconcrete,7,103,1774835811.0,-0.9964213371276855,Why do they continue to sign up to join and talk about their “service” if they get humiliated so?,comment,1s7chln,t1_od8kf3m
ilevelconcrete,7,103,1774837276.0,-0.9430403709411621,And everyone here talking about how our poor troops can’t be blamed for signing up for this are part of that process. ,comment,1s7chln,t1_od8m7lj
ilevelconcrete,7,114,1774877193.0,-0.9976711869239807,Maybe it’s the stress of working for an organization that does so much harm,comment,1s7q94h,t1_odb2b4w
ilevelconcrete,7,123,1774910613.0,0.9804792404174805,"No, there is no foreign boogeyman secretly responsible for all this. Trump is an American, he was elected by Americans, he is supported by millions of Americans. ",comment,1s855yl,t1_ode98po
FootballPizzaMan,8,20,1774539305.0,-0.9889979958534241,Trump: Iran is 'begging to make a deal',post,1s4auhj,
FootballPizzaMan,8,21,1774541106.0,-0.9385502338409424,They are letting ships through if they pay [marinetracker.com](http://marinetracker.com) shows everything,comment,1s4bj33,t1_oclpwlr
FootballPizzaMan,8,43,1774620353.0,-0.9357247948646545,How Trump lost the war with Iran,post,1s552cl,
FootballPizzaMan,8,44,1774624719.0,-0.9987473487854004,Consumer confidence tumbled in March as Americans worry about the Iran war's economic impact,post,1s572g9,
FootballPizzaMan,8,55,1774662661.0,0.7554043531417847,Trump news at a glance: Saudi Arabia wants US to intensify its war on Iran – its regional rival,post,1s5nh8d,
FootballPizzaMan,8,71,1774722206.0,-0.9676275253295898,US recession odds rise as Iran war escalates,post,1s67xqs,
FootballPizzaMan,8,106,1774849563.0,0.8779710531234741,Oil prices continue to rise as fears of U.S. ground invasion in Iran grow,post,1s7i566,
FootballPizzaMan,8,116,1774882172.0,-0.9887621998786926,Oil prices surge past $116 as Iran war escalates,post,1s7spce,
FootballPizzaMan,8,120,1774898545.0,0.6117116212844849,"Graham to Trump: ‘Wind down’ Iran war, ‘wind up’ efforts for peace deal",post,1s80hf0,
nosungdeeptongs,9,5,1774482538.0,-0.9963781237602234,Holy fuck maybe you’re right.  He’s demented and he thinks Iran gave him the jet.,comment,1s3pt2b,t1_ochghw4
nosungdeeptongs,9,5,1774483161.0,-0.9992986917495728,"I’m starting to see that as less likely with the way the administration is talking.  I think it’s more likely they just claim victory and leave much poorer and worse off than when they started, and with a new ayatollah who has additional incentives to reconsider if making an atomic bomb is truly haram.",comment,1s3js1s,t1_ochgr1c
nosungdeeptongs,9,48,1774638211.0,-0.9996212720870972,"I’m sorry, the director of the FBI fell for a phishing scam????",comment,1s5931o,t1_ocsyogz
nosungdeeptongs,9,71,1774721433.0,-0.9948433637619019,Israel knows the American public detests them and is anticipating that sentiment will elect politicians who will no longer unconditionally support Israel in the future.  They do not care how much damage the US takes because they have calculated that the US will be significantly less useful to them in the future.,comment,1s5lija,t1_ocvxqbk
nosungdeeptongs,9,102,1774834446.0,-0.9567135572433472,"And likely many others who will not admit it out loud.  For every loud, aggressive warmonger, there's five people quietly wondering ""I wouldn't want to be invaded, so why should we invade someone else?""",comment,1s7chln,t1_od8dwtl
BigHungryFlamingo,10,8,1774494351.0,-0.9951204657554626,He stuck his pecker in a hornet’s nest. ,comment,1s3vwj2,t1_ocik31x
BigHungryFlamingo,10,102,1774833481.0,-0.9982041120529175,The US *could* have a nationwide pizza party puppy parade and provide flying bicycles and balloons to everyone tomorrow but that probably won’t happen. ,comment,1s7ce7w,t3_1s7ce7w
BigHungryFlamingo,10,113,1774871480.0,0.999790370464325,"Oh, I’m sure this will be really popular with the common folk. ",comment,1s7na76,t3_1s7na76
BigHungryFlamingo,10,117,1774885949.0,-0.9990197420120239,"They’re not even pretending to give a fuck about veterans health. 

“Here, go off to war. Lose a limb, get traumatized. When you get back, you’ll be sleeping on the streets, loser.”

I’d defect. Fuck this shit. 
",comment,1s7ubwm,t3_1s7ubwm
BigHungryFlamingo,10,120,1774896948.0,-0.9607445001602173,"It blows my mind how the rhetoric surrounding healthcare coverage always focuses on patients and absolutely NEVER on the healthcare providers who need to get paid for their work. 

Cutting coverage for another 300,000 means more medical debt for patients and more barriers to care. But it also means healthcare providers end up taking a hit a lot of times because they don’t want to leave their patients stranded. 

The American Medical Association finally woke up from their long slumber about 10 years too late and has only finally begun pushing back against these cuts since maybe a year ago. 

I’m not saying this as an “oh, the poor doctors!” sentiment but more of a “there a ton of well-paid professionals and their clients who are going to get fucked because of this and nobody is organized to fight it.”

This should’ve never panned out like this. It didn’t have to. 

Insurers have the upper hand 1000x over while the people doing the actual work and the ones having the work done have just about zero leverage within the equation. ",comment,1s7zhwz,t3_1s7zhwz
BigHungryFlamingo,10,121,1774901016.0,0.99866783618927,"Well, not everybody…

The owners and private equity investors do wonderfully!

I unfortunately got to know that industry very well. Glad I’m no longer in it. I’ll never shut up about the things I saw and how we could improve. 
",comment,1s7zhwz,t1_oddgssb
GigMistress,11,46,1774633109.0,-0.9995941519737244,"I'm not sure what the ""impenetrable systems of the FBI"" have to do with a gmail account.",comment,1s57brt,t1_ocsdufs
GigMistress,11,49,1774640983.0,0.9886364340782166,Thus funding their defense against us...,comment,1s54b1p,t1_ocsbr4k
GigMistress,11,100,1774825594.0,-0.995275616645813,"In secret?

They're planning the ground invasion in press conferences.",comment,1s79w5y,t1_od7tfl7
GigMistress,11,117,1774886678.0,-0.678774893283844,"One would hope. I know Trump is unprecedentedly stupid, but declaring his precise invasion plans would be a new level even for him. The average kindergartner would know better.",comment,1s79w5y,t1_od95xcr
GigMistress,11,126,1774920280.0,-0.9908075928688049,What Netanyahu did to Palestine over a period of two years?,comment,1s79w5y,t1_odf3dz6
Sminahin,12,73,1774727704.0,-0.9984028935432434,"The narrative I've seen is more like ""all politicians lie"". I know a lot of people who voted Trump, Biden, Trump despite loathing Trump the whole time. Because they were so sure us Dems were even worse. A lot of these people never forgave us for running Kerry and were convinced both mainstream Dems and Republicans were blatant criminals and openly corrupt.


So they made a really stupid lesser evil decision based on branding and superficial political awareness.",comment,1s64qid,t1_oczkf2h
Sminahin,12,95,1774808740.0,-0.9993525147438049,"Haliburton profits aren't nothing, but they are worse than nothing.",comment,1s6znum,t1_od5oqe3
Sminahin,12,102,1774833123.0,-0.9943748712539673,"I mean, who wouldn't in their situation?",comment,1s7chln,t3_1s7chln
Sminahin,12,113,1774873795.0,-0.9993290901184082,The disgusting thing is that Iran beating us and especially Israel in this war is the better outcome for US interests.,comment,1s7alv4,t1_od7zx9d
Sminahin,12,120,1774898694.0,0.5924549102783203,"Huh, and here's me thinking it was a pretty funny despair-humor joke.  Maybe spending all day every day trying to keep your family alive as Anthem repeatedly tries to murder the people you love brings out the gallows humor.",comment,1s7qvw9,t1_odcl5i5
Sminahin,12,121,1774900868.0,-0.962617814540863,"&gt;Unfortunately extremists on both sides (less so in Israel now the 70's and 80's where crazy)

Less so now because the extremists in Israel won.  Netanyahu got Rabin assassinated in the 90s and has been in power about 30 years.  No need for that bitter infighting anymore if you're the eternal god-king of the state.",comment,1s7qvw9,t1_odcskpz
Sminahin,12,125,1774916974.0,-0.995895504951477,"Yes, I am fully aware.  I think internal US governance has failed so badly that we live in a dystopian state and are in denial about it.  I think we have been a full-blown rogue state and the worst sponsor of terrorism in the world for quite some time.  And I think the entrenched interests and outright undemocratic forces of corruption that have hijacked our system...maybe, *maybe* can be beaten.  But honestly, I'm not betting on it ever happening naturally &amp; internally.  Our democracy was hijacked long before Trump, and there's a very good chance that he or the 2032 election will be the full-blown death knell.",comment,1s7qvw9,t1_odev7y5
Theferael_me,13,93,1774802686.0,-0.993087112903595,"I'm not sure which is worse. The US winning or Iran winning. A 'win' for the US emboldens Trump and MAGA, makes it more likely that he'll invade other places and weakens international law even further. ",comment,1s6znum,t1_od5mzng
Theferael_me,13,100,1774825724.0,-0.990487277507782,Trump could end the war tomorrow if he wanted. He doesn't want and so the war goes on.,comment,1s79w5y,t3_1s79w5y
Theferael_me,13,101,1774829338.0,-0.9950842261314392,The US could've stopped Israel any time it wanted. It chooses not to.,comment,1s79w5y,t1_od82q5j
Theferael_me,13,102,1774832803.0,-0.9973257780075073,Do any journalists *ever* push back on his bullshit or do they just sit there nodding?,comment,1s7ce7w,t3_1s7ce7w
AdumbroDeus,14,118,1774889888.0,-0.590179443359375,"There's no substantial move and to be frank a big part of why American Jews have been Democrats is long term Republican antisemitism. Antisemitism that has only intensified under Trump, who I'll remind people, literally spread the conspiracy theory that resulted in the Tree of Life shooting by a guy who didn't even like him.

But it goes deeper than that, the last several Republican speakers of the house used the exact same style of antisemitic conspiracy they accused Omar of perpetrating, just explicit and substitute Soros for AIPAC.

Don't get me wrong, there are definitely concerns  about antisemitism getting more normalized among Dems, and to be clear it's not necessarily Israel specifically, but antisemitic tropes applied in criticism of Israel and while I don't agree with all the critiques some are definitely valid examples.",comment,1s7qvw9,t1_odb9k2k
AdumbroDeus,14,120,1774897073.0,0.9998186230659485,You're welcome!,comment,1s7qvw9,t1_odd0lr1
AdumbroDeus,14,132,1774940078.0,-0.9896621704101562,This article directly provides contrary evidence to that narrative though. ,comment,1s7qvw9,t1_odc0d0q
_May26_,15,4,1774480029.0,-0.996384859085083,"As Trump Threatens to Escalate Further, Majority of Americans Say Iran War Has Already 'Gone Too Far': Poll",post,1s3qj86,
_May26_,15,19,1774534140.0,-0.9714889526367188,'Heretical and Batshit Crazy': Hegseth Rebuked for Bloodthirsty Prayer Asking God to Bless Iran War,post,1s48hv0,
_May26_,15,27,1774563033.0,-0.9855440258979797,Top Democrats Face Rising Pressure to ‘Bring the Iran War Powers Resolution to the Floor Right Now’,post,1s4lkvf,
_May26_,15,28,1774565815.0,-0.9517296552658081,Fears of Imminent Ground Invasion Surge as Trump Weighs ‘Final Blow’ Options Against Iran,post,1s4mr9g,
