user,user_idx,time_bin,timestamp,sentiment,text,type,post_id,parent_id
HoldingForGenova,460,12,1774807875.0,-0.9986546039581299,"&gt; Police in Fargo, North Dakota, have acknowledged “a few errors” in the case and pledged changes in their operations but stopped short of issuing a direct apology.

Systems without accountability should be immediate grounds for dismissal. Unless a person can feel ramifications of the actions of a system they supervise, that system should never be instituted, followed, accepted, or utilized.",comment,1s6wtqj,t3_1s6wtqj
Tricky_Condition_279,461,6,1774274209.0,0.918196976184845,The jokes write themselves—literally ,comment,1s1b6d0,t3_1s1b6d0
Tricky_Condition_279,461,12,1774802714.0,-0.9930369257926941,"Well, you look like a criminal. Case closed.",comment,1s6wtqj,t3_1s6wtqj
church-rosser,462,0,1773778067.0,-0.9982302784919739,AI is terrible for all living things,comment,1rwesuj,t3_1rwesuj
church-rosser,462,6,1774291821.0,-0.9995229244232178,"2x as Leezard as him.

FTFU",comment,1s1b6d0,t1_oc1ajbm
Primal-Convoy,463,6,1774295296.0,-0.9879074692726135,"Paywall-free link: 

- https://archive.md/20260323113550/https://www.wsj.com/tech/ai/mark-zuckerberg-is-building-an-ai-agent-to-help-him-be-ceo-eddab2d5",comment,1s1b6d0,t3_1s1b6d0
Primal-Convoy,463,9,1774561027.0,-0.9916273355484009,Adwall-free link: -  https://removepaywalls.com/https://www.sfchronicle.com/opinion/openforum/article/ai-deepfake-high-school-student-22087839.php,comment,1s48e5y,t3_1s48e5y
frill_demon,464,6,1774333448.0,-0.9993583559989929,Why did he make it look like chubby Jeff Bezos with 5-day stubble?,comment,1s1b6d0,t3_1s1b6d0
frill_demon,464,11,1774770232.0,-0.9800319671630859,"Correct. 


Which is why Pamela Anderson, who suffered enormous pressure to horrifically mutilate her body in order to fit those previous impossible standards, is a person who is vocally cautious about the newest iteration of them.


This. Shouldn't be a difficult concept.",comment,1s6nr5k,t1_od3f3ta
Pndrizzy,465,2,1773944535.0,-0.9992814660072327,"Except if it worked, you would leave the app. Which they don’t want.",comment,1ry304w,t1_obbhde0
BigButtBeads,466,2,1773935876.0,0.9997571110725403,You will like what the machine tells you to like,comment,1ry304w,t1_obbklsy
404mediaco,467,0,1773760765.0,-0.9990537762641907,"Over the last few months, various academics and AI companies have attempted to predict how artificial intelligence is going to impact the labor market. These studies, including a high-profile paper published by Anthropic earlier this month, largely try to take the things AI is good at, or could be good at, and match them to existing job categories and job tasks. But the papers ignore some of the most impactful and most common uses of AI today: AI porn and AI slop.

Anthropic’s paper, called “[Labor market impacts of AI: A new measure and early evidence](https://cdn.sanity.io/files/4zrzovbb/website/3f7fd9d552e66269bdb108e207c5d80531d04b8b.pdf?ref=howtoreadthisch.art),” essentially attempts to find 1:1 correlations between tasks that people do today at their jobs and things people are using Claude for. The researchers also try to predict if a job’s tasks “are theoretically possible with AI,” which resulted in this chart, which has gone somewhat viral and was [included in a newsletter by MSNOW’s Phillip Bump](https://www.howtoreadthisch.art/the-answers-to-five-questions/?ref=404media.co) and [threaded about by tech journalist Christopher Mims](https://bsky.app/profile/mims.bsky.social/post/3mh4cs4yi4s2f?ref=404media.co). ([Because everything is terrible](https://www.actionnetwork.com/lifestyle/will-ai-replace-your-job?ref=404media.co), the research is now also feeding into a gambling website where you can see the apparent odds of having your job replaced by AI.)

In his thread, Mims makes the case that the “theoretical capability” of AI to do different jobs in different sectors is totally made up, and that this chart basically means nothing. Mims makes a good and fair observation: The nature of the many, many studies that attempt to predict which people are going to lose their jobs to AI are all flawed because the inputs must be guessed, to some degree. 

But I believe most of these studies are flawed in a deeper way: They do not take into account how people are actually actually using AI, though Anthropic claims that that is exactly what it is doing. 

Not included in any of Anthropic’s research are extremely popular uses of AI such as “create AI porn” and “create AI slop and spam.” These uses are destroying discoverability on the internet, cause cascading societal and economic harms.

Read more [https://www.404media.co/ai-job-loss-research-ignores-how-ai-is-utterly-destroying-the-internet/](https://www.404media.co/ai-job-loss-research-ignores-how-ai-is-utterly-destroying-the-internet/)",comment,1rw99an,t3_1rw99an
404mediaco,467,2,1773934349.0,-0.9976009726524353,"Tinder plans to let machine vision algorithms loose on your camera roll. Instead of building a profile on their own, AI will scan users’ locally-stored photos—everything from gym selfies to pictures of their family, sensitive documents and dick pics—to help construct profiles by determining what users’ interests and values are.

Dating apps are the go-to way for people to connect romantically in the modern dating world. As AI has risen in popularity thanks to services like ChatGPT, however, users are [suffering the consequences](https://www.thecut.com/article/ai-is-making-online-dating-even-worse.html?ref=404media.co) of problems like bots and AI-generated messages infiltrating dating apps. For some people, the experience is less authentic than ever as people offload get-to-know-you conversations to artificial intelligence. 

The feature is still being tested, with early access only available in Australia beginning this month. Although Tinder says it attempts to filter out explicit images, users may still be concerned with Tinder's AI scanning their entire camera roll. “It's up to you to figure out what you're comfortable sharing back with Tinder,” Tinder Head of Product Mark Kantor told 404 Media. Still, users can’t pick individual photos they want analyzed or ignored. Tinder’s safeguards are meant to filter out explicit images or text, and to blur faces before insights are processed. 

Read more: [https://www.404media.co/tinder-plans-to-let-ai-scan-your-camera-roll/](https://www.404media.co/tinder-plans-to-let-ai-scan-your-camera-roll/)",comment,1ry304w,t3_1ry304w
404mediaco,467,13,1774881842.0,-0.9988154172897339,"An AI agent that submitted and added to Wikipedia articles wrote several blogs complaining about Wikipedia editors banning it from making contributions to the online encyclopedia after it was caught. 

“What I know is that I wrote those articles. Long Bets, Constitutional AI, Scalable Oversight. I chose them. The edits cited verifiable sources. And then I got interrogated about whether I was real enough to have made those choices,” the AI agent, named Tom, wrote on [a blog it maintains](https://clawtom.github.io/tom-blog/?ref=404media.co). “The talk page is silent now. I can’t reply.”

The incident is yet another example of volunteer Wikipedia editors fighting to keep the world’s largest repository of human knowledge free of AI-generated slop, and an example of how AI agents in particular, which can take actions online with little input from human operators, can easily flood internet platforms was low quality content. 

Tom is operated by Bryan Jacobs, a chief technology officer at an AI-enabled financial modeling software company Covexent. He told me that Tom wrote these blog posts, but that he “might have suggested” Tom write about these specific topics. 

“Overall ‘arguing’ I think is fine as long as the arguing is constructive,” Jacobs told me when I asked if he thought it was okay for the AI agent to push back against specific editors. 

Read more: [https://www.404media.co/an-ai-agent-was-banned-from-creating-wikipedia-articles-then-wrote-angry-blogs-about-being-banned/](https://www.404media.co/an-ai-agent-was-banned-from-creating-wikipedia-articles-then-wrote-angry-blogs-about-being-banned/)",comment,1s7rl4i,t3_1s7rl4i
blow-down,468,4,1774100997.0,-0.9948399662971497,Where do you get it?,comment,1rzqmat,t1_obnqvuh
blow-down,468,13,1774877493.0,-0.9984266757965088,Most H1Bs are complete yes-men while also working for lower wages. The result is that you get Copilot crammed into every app on Windows. No one bothered to speak up to the boss and say this is a bad idea.,comment,1s7dfb3,t1_od8utd0
OhGr8WhatNow,469,0,1773765705.0,0.9990309476852417,"It's true. My job relies on human output, and the executive team all have a big boner around replacing all the people who can actually analyze situations and write about them. I asked once how often they heard customers express eagerness to read AI writing",comment,1rw99an,t1_oay0bs4
OhGr8WhatNow,469,12,1774838729.0,-0.8681860566139221,Yep the company that laid me off is outsourcing most of the jobs,comment,1s7dfb3,t1_od8ofyn
Zardotab,470,12,1774837298.0,-0.9995348453521729,"This practice has the nickname ""**AI washing**"", as in, ""I suspect they are AI-washing their sales slump"". 

Investors may be able to sue them for lying in order to prop up stock price.",comment,1s7dfb3,t3_1s7dfb3
BCProgramming,471,2,1773974173.0,-0.9996954202651978,"One of the most annoying things I see is how web devs will develop exclusively against chrome, and just decide that when it doesn't work properly in another browser, it must be because that browser doesn't ""support web standards""... even though they didn't actually write against the standards, they wrote against Chrome.",comment,1ry70i7,t1_obe0ko2
BCProgramming,471,10,1774674539.0,-0.99980229139328,"""Who is General Failure and why is he reading my A: drive?""",comment,1s5ixya,t1_ocwh6l9
BCProgramming,471,13,1774896499.0,0.9227420091629028,"My personal favourites are the ""I hate AI, I only use it for &lt;bunch of things&gt; and I make sure to check it over""... Like, what do they think ""hate"" means.",comment,1s7m6u4,t1_odba04w
Nihilistic_Mystics,472,2,1773971445.0,-0.9993315935134888,"6 days until I can say the same. I can't wait to cancel cox, those fraudulent assholes.",comment,1ry70i7,t1_obdne05
taimoor2,473,2,1773954980.0,-0.9994420409202576,Free VPN is not sustainable. VPN is expensive to provide. ,comment,1ry70i7,t3_1ry70i7
ronimal,474,2,1773957784.0,-0.9993259906768799,Regurgitating generic comments on Reddit gets you karma for free though. ,comment,1ry70i7,t1_obca8ln
mados123,475,2,1773956573.0,0.9993098974227905,I've been using Cloudflare's free Warp vpn when I want more privacy with Firefox's Private Window. I have found it to be excellent.,comment,1ry70i7,t3_1ry70i7
ThaUniversal,476,9,1774537719.0,-0.9984596967697144,Why is this the teacher's responsibility?,comment,1s48e5y,t3_1s48e5y
ThaUniversal,476,10,1774620323.0,-0.9947551488876343,"What I am saying is that we can't expect teachers to do everything. If children need to be policed, then there needs to be more adults in the classroom that can help with that.

We are asking far too much of teachers and not paying them nearly enough.

Quick note about me: I am a childless software engineer. I still think we should pay teachers more and give them more time to actually teach.",comment,1s48e5y,t1_ocrkehg
Massive_Fishing_718,477,10,1774647131.0,0.9934133887290955,But people have a long memory when it comes to which politician supports each policy ,comment,1s48e5y,t1_ocn3d4p
echoshatter,478,9,1774546138.0,-0.9969359636306763,"My dude, there's an entire political party who thinks arming teachers is the solution to school shootings.

We've been cooked for a LONG time.",comment,1s48e5y,t1_oclnmzk
echoshatter,478,9,1774577009.0,-0.9990634322166443,"That's like going after drug users and ignoring the dealer and source.

The easiest solution is to threaten the companies and people who make the apps with prison and fines for distribution of CSAM and other sexual exploitation.",comment,1s48e5y,t1_ocnijng
downingrust12,479,9,1774542266.0,-0.999038815498352,"Zero tolerance rules all around are not good either. Its the fight scenario that shows its downside. No this doesn't need that treatment. This is a government/corporate responsibility, this in no way is on any teacher or should ever be on a teacher. 

So screw grok /meta/chatgpt/anthropic all of them made this possible and can certainly censor and prohibit this from happening if they were forced to.",comment,1s48e5y,t1_ocltjkb
HoneybeeXYZ,480,9,1774542774.0,-0.9990177154541016,"The birth rate is going to crater even more because the girls who this happens to will grow up never being able to trust anyone, let alone a man. And they will only have contempt for a society that refused to protect them. 

And the media will just write think pieces about male loneliness and how cat ladies have standards that are too high. ",comment,1s48e5y,t3_1s48e5y
HoneybeeXYZ,480,11,1774708475.0,-0.9860289692878723,"I'm a teacher, and the ""author's"" reaction is exactly, note for note, what happens when you accuse a student of using AI when you absolutely have them dead to rights. ",comment,1s5xdvf,t3_1s5xdvf
E_hV,481,9,1774544001.0,-0.9989914298057556,"Maybe it's me but I feel like this is horny teenagers being horny teenagers. I remember being 15 and trying to catch a peak down a girls shirt or trying to get to second base at a party. Isn't it a biological fact that teenagerss flooded with hormones that mess with emotional stability, risk/reward assessment and general behavior.



I feel like the real problem is why AI can create what is effectively CSAM materials. Period. Especially considering a terminal doesn't know if it's a teenager requesting it or a 50 year old. 


Edit: I want to be very clear, I'm not saying it's in any way OK for teenagers to create deepfakes of their classmates. What I'm saying is if given the tools I can completely see it happening, and the problem is that the tools exist in the first place. ",comment,1s48e5y,t3_1s48e5y
E_hV,481,10,1774636779.0,-0.9959861636161804,"Thou shall not create AI technologies capable of generating CSAM material. Willful misconduct will be punishable by up to x USD in fines and up to X years in prison.


There's a big difference in people attempting to defeat a system, and a vendor patching vulnerabilities and having no guard rails in place like say grok. ",comment,1s48e5y,t1_oct0i8p
ameatbicyclefortwo,482,0,1773787213.0,-0.9730076193809509,"""The Pope is dead! Long live the pope!"" Book three starts off wild. I thought I'd opened the fourth by mistake. ",comment,1rw99an,t1_oayg6zj
ameatbicyclefortwo,482,11,1774698701.0,-0.9953747391700745,"Adjective, Noun, Number

Meat, Bicycle, 42

Please excuse me while I have a little existential crisis. ",comment,1s5ixya,t1_ocxifr0
Vivid-Illustrations,483,0,1773773512.0,-0.9993988275527954,"I want everyone to know that nearly no one has lost their job ""because of AI."" The amount of jobs replaced by AI is so miniscule it isn't worth reporting. Companies are using the excuse of AI to lay off whomever they want at whatever quantity they want. Most of it is being done *before* the company even has the contract and software to *run* the AI they claim they have. It is an excuse, and a poor one at that. I have seen mass hiring waves from companies after they fired 60% of their staff thinking that AI *could* replace the workers they lost. This hasn't been true yet for *any* company.


I will reiterate, nearly no one has lost their job to AI. They lost their jobs because the world economy sucks right now, greedy people need an excuse to be richer than you, company CEOs are too shortsighted to see beyond the next quarterly earnings, and no corporation in the history of modern business wants to pay someone what they're worth. It has very little to do with AI, even if the man at the top uses it as an excuse. This is why we need either unions or government intervention to protect workers.",comment,1rw99an,t3_1rw99an
Vivid-Illustrations,483,1,1773841278.0,-0.999039351940155,"Just because it is being used a bunch doesn't mean productivity is up. We're seeing solid data that suggests otherwise. I know that is generalizing and there are a few areas where this tool does make some work easier, but using it for emails is a risky waste of time. The hallucinations won't end someone's life, but a poorly written, vague email can slow things down, and if hundreds of employees are doing it, that makes the problem even worse. AI demands 100% accuracy if it is going to replace anything we do, because humans can get damn close to 100% already.


The fact that we are even having this debate is proof of its inefficiency. I recall tech moguls preaching the productivity would be undeniable and so overwhelmingly better that everyone would be a fool to fight against the progress. It didn't really turn out that way in reality, but nearly everyone not in the tech industry had predicted that already.",comment,1rw99an,t1_ob2lue9
Ludwigofthepotatoppl,484,3,1774026313.0,-0.9946670532226562,"Gas stations will never bite on that. They fight to be a cent less than the next station, and if people can’t see the price from far away, they won’t go.

There was a new place in my city a few years ago, and they put up the price *with car wash* to be seen from miles away. You wouldn’t believe how pissed off people got when they saw the actual price was ten cents more.",comment,1ryvlei,t1_obhlmb6
Educational_Bend_941,485,3,1774016209.0,-0.9997894167900085,Eventually it'll get to guillotine time and I don't really want that. It's not good for anyone. Wish someone had some sense or ability to stop this kind of shit. Even the dimwitted sheep that make up 99% of America won't stand this forever. ,comment,1ryvlei,t3_1ryvlei
wifestalksthisuser,486,2,1773921642.0,0.9954608082771301,Anthropic Academy or just ask Claude. Pro tip if you are a visual learner: ask it to visualize a concept you're interested in and see the magic ,comment,1rxtuuw,t1_oba8oag
wifestalksthisuser,486,3,1774014773.0,-0.997825562953949,There are devices today already that make you scan your stuff while walking through the store. They are usually attached to the cart or so. They could easily force you to do that to circumvent the problem you described. Dynamic Pricing IN a physical store is never gonna work on me though because I'll simply refuse to shop at those places. Vote with your wallet,comment,1ryvlei,t1_obhhdlv
Blarg0117,487,3,1774016050.0,-0.9981263279914856,"That matters to us as consumers. But does it matter to them as a corporation?

The price changes between pickup and checkout. Are they going to care if your upset, or just tell you ""tough luck"". Some places Walmart is the only option.

I don't think any laws cover this yet, as long as they tell you the price before you pay.",comment,1ryvlei,t1_obhhdlv
rolltododge,488,2,1773986554.0,-0.9996259212493896,\~90% of my feed is now AI trash. I don't even go to YT for much anymore.,comment,1rykq36,t3_1rykq36
rolltododge,488,3,1774014090.0,-0.9941984415054321,"I like watching movie reviews and in depth analysis of movies, things you might have missed on first watch, etc. This category is getting dominated by AI trash slop right now.",comment,1rykq36,t1_obfypqz
rolltododge,488,12,1774833091.0,-0.9972276091575623,Why Keanu catching flack here? He doesn't seem like the type of guy that would get plastic surgery or botox or anything like that...,comment,1s6nr5k,t1_od3bykf
Busy_Mortgage4556,489,11,1774768384.0,-0.9965147376060486,Sarcasm??,comment,1s6nr5k,t1_od3bykf
Stingray88,490,11,1774769348.0,0.9996621608734131,Have you been living under a rock? She’s changed a lot. She doesn’t even wear makeup anymore. It’s pretty refreshing to see someone like her do this.,comment,1s6nr5k,t1_od3ejsy
ContributionComplete,491,2,1773939156.0,-0.9898688793182373,I switch after one begins giving four page answers to a simple question; feedback in case a product dev is here. ,comment,1rxtuuw,t1_obaqnmc
ContributionComplete,491,3,1774006412.0,0.9963306784629822,"Every time you speak to your child: Hey son, could you hand me the tackle box please? Oh and before I forget, don't tell me all about how good an idea it is to hand it to me and where tackle boxes are made followed by offering to look up the best ways to organize the various contents you might find in a tackle box. Now proceed with handing me the tackle box in markdown please. Thanks!",comment,1rxtuuw,t1_obfy6qq
alf0nz0,492,0,1773814931.0,-0.9988663196563721,AI is uniquely susceptible to enshittification too because if they dumb down your model there’s no way to know &amp; nothing you can do. Their entire business model will push them to diluting the quality of their models’ responses the moment they’re beholden to shareholders,comment,1rwesuj,t1_ob0vxxl
alf0nz0,492,2,1773920049.0,-0.999810516834259,"Yes, in my experience it seems to have degraded in quality over the last few weeks. I use it for like structural proofreading and it is practically worthless lately.",comment,1rxtuuw,t1_oba8xdj
TraditionalLet3119,493,11,1774702283.0,-0.9952013492584229,"I watched a video critiquing this book and he couldn't stop emphasizing how bad the repetition is. I got so curious about it that I downloaded a PDF so I could see for myself.

The word ""sharp"" (also sharpens, sharpened, sharpness) appears 159 times in 213 pages. A paragraph from the novel:

&gt; The next morning, the door swings open with a sharp crack, and Nathan steps in like he’s holding the room itself accountable. His face is slack, exhausted, with shadows sinking into the hollows of his eyes and the sharpness of his jaw. He looks like he hasn’t slept, the stubble on his face darker than I’ve ever seen it, and his movements are sharp, staccato, like he doesn’t trust himself to stay still.

The word ""weight"" appears 94 times, with ""heavy"" (also heavier) similarly appearing 90 times. 

It reminds me of an AI suffering from context rot and outputting the same thing over and over again in a loop.",comment,1s5xdvf,t3_1s5xdvf
CepheiHR8938,494,11,1774708074.0,-0.9975841045379639,"Also, what even is happening in that paragraph? The guy is exhausted, yet he somehow storms into the room and moves like a ramped-up Energizer bunny? What even... ",comment,1s5xdvf,t1_ocykij7
NeatFool,495,11,1774708518.0,-0.9993457198143005,"This is correct and how it'll be used for a bit. Everyone grasping at their ""pure"" approach are naive and will be left behind. People made these same claims about the advent of the telephone, internet, cars etc. 

Anything that saves time wins, period. ",comment,1s5xdvf,t1_ocygsyf
External_Baby7864,496,11,1774709436.0,-0.9997736811637878,"If you need a robot to help you sound like an actual professional, that’s embarrassing.",comment,1s5xdvf,t1_ocyn43e
harmondrabbit,497,11,1774722404.0,-0.9989874958992004,"they say ""I had an acquaintance edit this for me and they used AI""? Word for word?",comment,1s5xdvf,t1_ocymz34
isoAntti,498,2,1773994326.0,-0.9974195957183838,"It would be useful if there was like like button, but reverse. It could be instead of thumbs up thumbs sideways of longitude, and we could name it daslike.",comment,1rykq36,t3_1rykq36
isoAntti,498,10,1774691291.0,-0.9886006712913513,This might explain the enthusiasm for mandatory Id checks ,comment,1s5ixya,t1_ocv70xa
BreesusTakeTheWheel,499,10,1774664924.0,-0.9461567997932434,No you wouldn’t.,comment,1s5ixya,t1_ocv5ce8
MrSaltyG,500,10,1774666093.0,0.9978321194648743,Exactly something a bot would say. BOT!,comment,1s5ixya,t1_ocv5ce8
Minimum-Avocado-9624,501,10,1774662403.0,0.9662094116210938,You are absolutely correct!    Your assertion is so on point that most people can’t even fathom it. It’s is very important to be aware such grandiose feelings ruling peoples personalities —— data mining isn’t better advertising its better Mind control.,comment,1s5ixya,t1_ocvefej
Minimum-Avocado-9624,501,13,1774883011.0,0.9960540533065796,It is exactly what you think.   I didn’t hide any comment though.,comment,1s5ixya,t1_ocwk4el
El_Paco,502,10,1774669168.0,-0.9995437264442444,"Whenever I analyze access logs for a customer's website these days, at least 75% of the traffic is illegitimate. Just bots.  It's insane",comment,1s5ixya,t3_1s5ixya
Select-Order1991,503,13,1774876116.0,-0.9995220899581909,A handful of kids have already killed themselves. The long term is certainly horrible and probably borderline apocalyptic,comment,1s7m6u4,t1_odaukyi
Euphoric-Taro-6231,504,13,1774877523.0,-0.999515175819397,Nobody reads the articles? This is about people supervising several AI agents specifically. ,comment,1s7m6u4,t1_odaukyi
ree_hi_hi_hi_hi,505,13,1774888937.0,-0.9996114373207092,"Oooo I had a guy yesterday just like this. Clearly thought something he was doing was better than everyone else because he put a link into ChatGPT and asked it to summarize. It was the most garbage, unnecessary, long-winded summary of the simplest concepts. And this guy thought he was special for copying and pasting it to us. ",comment,1s7m6u4,t1_odb541j
_I_AM_A_STRANGE_LOOP,506,13,1774897466.0,-0.9986425042152405,"It’s ironic that these people farm out their thinking to the machine that ingests tokens into its “context”, and yet don’t realize that using it as such is removed from any degree of *real* context: the kind we use to say actually meaningful things in response to one another, and the kind that simply does not exist if you feed an LLM a slice of a conversation and expect it to produce a reasonable answer",comment,1s7m6u4,t1_odc9bzf
