user,user_idx,time_bin,timestamp,sentiment,text,type,post_id,parent_id
troll__away,95,7,1774390291.0,-0.9996751546859741,The money train has run dry. Subsidized AI is coming to an end. Time to see if it is actually productive enough to be profitable. ,comment,1s2piv1,t3_1s2piv1
troll__away,95,10,1774629472.0,-0.997470498085022,"I think Microslop investing $200B more into OpenAI could help. Then Nvidia could invest $100B each into OpenAI and Microslop, and then OpenAI could purchase $300B Nvidia chips and give them to Microslop to run on Azure Cloud and sign a 30yr lease agreement worth $50T. Maybe then this would all workout. ",comment,1s52nc8,t1_ocri5ao
troll__away,95,11,1774702725.0,0.9790319204330444,Don’t worry OpenAI’s new advertising made them $100 million annualized revenue. Surely that will be enough to cover all their data center spending and make them profitable. ,comment,1s5x48n,t1_ocxp9tm
troll__away,95,12,1774866747.0,-0.9892619848251343,Bingo. It’s called ‘AI-washing’. ,comment,1s7dfb3,t1_od8ll4m
redpandafire,96,0,1773771522.0,-0.9982458353042603,"Gaming is like 1% of their profit. If you told Jensen that gamers were unhappy, he’d ask if gamers are a new AI model. Otherwise, don’t care, ship it.",comment,1rwde7b,t3_1rwde7b
redpandafire,96,7,1774386009.0,-0.9994749426841736,Every move is them getting ready for IPO. Sora is shutting down. In this format.,comment,1s2piv1,t3_1s2piv1
redpandafire,96,10,1774612639.0,0.9963454604148865,Bold of you to assume the investors trade on reasonable thoughts.,comment,1s51flq,t1_ocr7250
redpandafire,96,11,1774702096.0,0.9830979704856873,House of cards surrounded by fire,comment,1s5x48n,t3_1s5x48n
Equivalent_Lunch_944,97,0,1773771472.0,-0.999345600605011,"Dumb question but can we just make a second Internet that is tied to personal identifiers (state id, etc)? Kinda like the great firewall in China",comment,1rw99an,t3_1rw99an
Equivalent_Lunch_944,97,8,1774452092.0,0.9985716342926025,Hopefully Palantir is his “Thor: Love and Thunder”,comment,1s3cykn,t1_ocejlsk
Equivalent_Lunch_944,97,11,1774703628.0,-0.8625677227973938,Softbank’s only win has been Alibaba right?,comment,1s5x48n,t3_1s5x48n
Equivalent_Lunch_944,97,13,1774873488.0,0.548324704170227,Wow. Maybe AI can actually replace the insurance industry.,comment,1s7oy34,t3_1s7oy34
RatBot9000,98,7,1774361763.0,-0.7618815302848816,"My eye opening moment about how insane GenAI defenders are is when I saw a post in the Defending AI Art sub which basically said they just tell the AI to draw good and avoid mistakes.

These people tell us prompting is a skill and then they're just writing simple, one word at a time instructions and ending it with ""draw well, no mistakes."" and then patting themselves on the back when the AI finally does what they ask (after 50+ spins of the wheel.)",comment,1s2cme5,t1_oc714e2
RatBot9000,98,9,1774533420.0,0.9927051663398743,"My brother works for a bank and from what he tells me you'd be surprised at the sheer level of supposedly educated people who are easily scammed by someone speaking at them with an air of authority.

Just because someone is smart doesn't always mean they're wise.",comment,1s442o9,t1_ock7pmg
RatBot9000,98,13,1774887612.0,-0.9968696236610413,"Calling it a boring, mundane and reasonable mission undersells it a little I think.  It was also told it had to complete its mission above all else and given no other options but to commit blackmail.  From the article you linked:

&gt;We deliberately created scenarios that presented models with no other way to achieve their goals, and found that models consistently chose harm over failure. To be clear, current systems are generally not *eager* to cause harm, and preferred ethical ways to achieve their goals when possible. Rather, it’s when we closed off those ethical options that they were willing to intentionally take potentially harmful actions in pursuit of their goals.

The AI doesn't choose to blackmail, because it doesn't choose at all.  LLMs are just very complex pattern matching system and when you give them very specific parameters, they will attempt to match those parameters no matter what that may involve because they have no concept of what they are doing.  It reasoned nothing, it predicted that blackmail was the only option it had and did so accordingly.

It underlines why these tools can never be allowed to make important decisions.",comment,1s7rl4i,t1_odbe4nr
StoppableHulk,99,7,1774362349.0,-0.999504566192627,"Watched a video on a ""ICCPO,"" a new term these people are apparentlly creating to mean a chief product officer who codes with AI, explaining how they use agentic AI to prioritize their calendar. 

Like, this is all so fucking stupid. I am not running an entire program just to prioritizea my calendar. Just look at it each week. It doesn't take that long. These aren't solutions that require AI. 

If you're generating and simulating the properties of new molecules for drugs, fine, that's great, good use of AI. 

If you're using it to tell YOU what meetings YOU should go to on YOUR calendar, that's fucking stupid. I'm sorry, but that's a 20 minute activity each week and maybe a few minutes each morning, which YOU should do.

How can an AI ever BETTER understand the context of where you should spend your time, than you? And once you surrender that fundamental judgment of *what you should do* to your AI, then truly, what is the point of you? 

Moreover, the context changes constantly. I get new information throughout the day, which does and SHOULD change my judgment of how I spend my time. If I have to update the AI constnatly with that new context, just so it can apply it to my calendar... how is that more efficient? 

All this shit is so insufferably stupid. Every single time I watch videos on how people in tech are applying this technology is the dumbest usecase I can imagine. Peopel are literally jsut doing this to be SEEN doing it, because the entire industry is so totally brainrotted.",comment,1s2cme5,t1_oc7acio
Thefrayedends,100,7,1774360869.0,-0.9991783499717712,"I've had the same perspective for a long while as well.

I've spent a lot of time playing with them recently since it was becoming obvious I didn't have a strong understanding of their mechanics.

I've learned that you can drastically improve the outcomes of answers, and eliminate the parts where it blows smoke up your ass, and asks you if you'd like to know more, with many of them, you can create an ""initialization"" assigning a persona to them, and stripping down much of the fluff.  For commercial models there are layers you just cannot remove at all, but for locally hosted models, you can get it to do literally anything that anyone could do with text, including not, or less, legal things.

Initializing them in specific ways, for specific tasks can act like a lens that allows you to get significantly more accurate answers.  I've set up 6 different agents now, and if I ask them all the same question, I get six varying answers, with obviously only one of them being the 'closest' to the truth.  As an example, if you ask it to speak strictly as a 2 year old that also has only started hearing english three months ago, it's not going to be able to give you a useful answer about high level academic fields of any sort.

They still suck ass, and are way overhyped, but you can wring a lot more usefulness out of them than I thought.

However, ideas around AGI being right around the corner, or just on the horizon are an absolute joke, we are absolutely nowhere near achieving universal or general intelligence.",comment,1s2cme5,t1_oc72a6g
Thefrayedends,100,9,1774536420.0,-0.9994485974311829,"Yea, they fired all the alignment teams a couple years ago already.",comment,1s45g56,t1_ockkqe1
Thefrayedends,100,13,1774881809.0,-0.9923858642578125,"One of them was murdered over this and they still didn't slow down lol.  The value of a human life in the mind of the rich has passed 0 dollars, and is actually sinking into the negatives.

They want to kill us.  They want to lower the mouths to feed and they think AI and robots will solve all their problems in the very near future.  And fuck, but they might even be right, it's sickening.",comment,1s7oy34,t1_odatcyy
buyongmafanle,101,0,1773754108.0,-0.9997984766960144,How about just quitting AI video? I'd wager it's most of the load and the lowest quality shit that AI is producing.,comment,1rw5l7k,t3_1rw5l7k
buyongmafanle,101,3,1774005485.0,0.9792551398277283,Some people drink at the fountain of success and leave when they've had enough. Some drink forever and make sure the rest waiting in line die of thirst.,comment,1ryfvka,t1_obeyftf
buyongmafanle,101,13,1774875338.0,-0.979252278804779,NO WAIT! WE DIDN'T MEAN IT LIKE THAT! *Panicked unplugging sounds*,comment,1s7oy34,t1_odat20w
SomeSamples,102,0,1773789876.0,-0.9819011092185974,Somebody in another sub has been saying how great AI is and all the great things is does.  I keep saying I don't want or need it and I think many others feel the same.  And then add on the cost of these data centers...The average person doesn't need any of this.  ,comment,1rw5l7k,t3_1rw5l7k
SomeSamples,102,2,1773937622.0,0.5740670561790466,Describe a way to get people to quit using Tinder without telling them directly to quit Tinder.  ,comment,1ry304w,t3_1ry304w
SomeSamples,102,6,1774284711.0,0.9979372024536133,Will be interesting to see how the AI runs the company after it gets rid of Mark.  ,comment,1s1b6d0,t3_1s1b6d0
SomeSamples,102,7,1774406489.0,-0.9951445460319519,Should be posted to r/NoShitSherlock ,comment,1s2gt0a,t3_1s2gt0a
kummer5peck,103,0,1773779316.0,-0.9936127066612244,Good thing we invested so much into AI that we’re going to lose our shirts if it doesn’t pan out.,comment,1rwesuj,t3_1rwesuj
kummer5peck,103,1,1773844466.0,-0.9970784187316895,"Am I so out of touch? No, it’s the children who are wrong.",comment,1rx3vza,t3_1rx3vza
kummer5peck,103,8,1774444184.0,-0.9932166934013367,How about fewer CEOs and corporate executives? Whenever you year people say stuff like this they don’t mean it for themselves.,comment,1s39x19,t3_1s39x19
kummer5peck,103,12,1774838146.0,-0.9986554384231567,It distances them from their own accountability for their own mismanagement.,comment,1s7dfb3,t3_1s7dfb3
dadvader,104,11,1774778726.0,0.9247063994407654,"This.

I don't like generative AI as much as anyone but there is LL in the LLM for a reason. Its primary purpose was to created to do this job ever since its inception. This is what it will excels at and translator will certainly be the first to go because of it.

English is not my first language. I'm Thai. And Reddit had already adapted to use AI translator and it manage to translating almost 98% exactly as how Thai are speaks. It genuinely feels natural. 

There might be some weird kinks here and there (mostly idiom that doesn't have Thai equivelent. But many of them have Thai equivelent and it basically translate into our idiom. Now that is genuinely mind-blowing) but if you're translator I would transition myself to creative writing or novel localization ASAP. I would not stick around in this line of work if I were you. They are that *good* now and the market demand will just keep shrinking from here on out.",comment,1s61pjs,t1_od0csa6
dadvader,104,13,1774900380.0,0.874995231628418,Reddit see the word AI and jump on it instantly even before any nuance of conversation could've taken place. The irony of this being a sub discussing about human-made technology lol,comment,1s7m6u4,t1_odd2868
dangerbird2,105,2,1773935779.0,-0.9954185485839844,it's not sentient. It just did a better job at asskissing and triggering AI psychosis than other models.,comment,1rxtuuw,t1_obbmp38
dangerbird2,105,11,1774709894.0,0.7692402601242065,"Fun fact: Machine translation is actually the main task LLMs were originally designed to do. All of the other stuff is more or less accidental, at least initially",comment,1s61pjs,t1_ocyo61a
little_lamplight3r,106,11,1774713935.0,-0.9984481334686279,"As a videogame translator, I'm stockpiling popcorn for the next KCD instance. LLMs can't do shit when there's no context, and they can't play the game before translating its files",comment,1s61pjs,t1_ocyo61a
za72,107,1,1773904909.0,-0.9966341853141785,have you pressed your copilot key today citizen?,comment,1rx3vza,t1_ob46q0r
za72,107,9,1774542671.0,0.9460022449493408,"a conspiracy doesn't need participants to meet and agree, others see a direction/trend and follow the breadcrumbs and decide to participate and influence the direction",comment,1s4absz,t1_ocllmhe
za72,107,9,1774593795.0,-0.9227001070976257,well whats the metric tests we could use to test this independently,comment,1s4ugwq,t1_ocpurpe
DragoonDM,108,5,1774205721.0,-0.9988378882408142,"Malware aside, the citation links also seem to often not actually say what the AI cited them for. I've noticed this in particular with Google's AI search summaries.",comment,1s0mv9h,t1_obuu2gn
DragoonDM,108,8,1774455909.0,0.837003231048584,"25 gigs of text _when compressed_, at that. Text compresses crazy well. Probably well over 100 gigabytes when extracted.",comment,1s39x77,t1_ocelwn5
DragoonDM,108,10,1774647656.0,-0.993948221206665,Research teams at Microslop hard at work finding new and innovative places to put Copilot buttons.,comment,1s52nc8,t1_ocri5ao
DragoonDM,108,13,1774895379.0,-0.9990191459655762,"""...let's put it in charge of autonomous weapons!"" - the fucking Pentagon.",comment,1s7rl4i,t1_odbfgjo
Shr1mpolaCola,109,2,1773918142.0,-0.9597259163856506,Reckoning NOW! Tf?,comment,1rximkr,t3_1rximkr
Shr1mpolaCola,109,3,1774022551.0,0.9937466382980347,"Ffs, you made me look 🫣😩",comment,1ryyz20,t1_obia9ab
Shr1mpolaCola,109,4,1774119374.0,-0.9271117448806763,"Good... ?

I'm pretty okay with the AI boom suffering, I'm just not cool with everything else that will potentially suffer that we don't yet know about",comment,1rztol1,t3_1rztol1
Shr1mpolaCola,109,11,1774702779.0,-0.9995357990264893,Where are they getting all this money from???,comment,1s5x48n,t3_1s5x48n
74389654,110,0,1773776782.0,0.9997009038925171,"yes, yes it is ",comment,1rw5l7k,t3_1rw5l7k
74389654,110,1,1773853335.0,-0.9987726807594299,it's in fact more expensive and less reliable than humans ,comment,1rwesuj,t1_oazi24d
74389654,110,9,1774527770.0,0.6481820940971375,now that they equip autonomous weapons they don't need side quests anymore ,comment,1s45g56,t3_1s45g56
JahoclaveS,111,3,1774019921.0,-0.9994500279426575,How long until racist maga fucks blow a gasket because the ai tech bros never dealt with systemic racism in the training data and it turns out minorities are getting everything cheaper?,comment,1ryvlei,t1_obhlmb6
JahoclaveS,111,9,1774534762.0,-0.9996968507766724,"If I have to hear one more exec tell me how great copilot is because they did some trivial shit with it… like, can you fuckers not. In my team’s attempts to get it to do anything useful it would insist on changing the name of the company. It also wasn’t worth a damn for any tasks we tried it for. You know, actual work, not some floofy engagement bullshit. 

I really want to force every MBA to have to go over to their English department and take a critical theory course if only because it might help them have an independent thought for once in their life and stop falling for every stupid line of marketing bullshit they’re fed. ",comment,1s45g56,t1_ockypyy
JahoclaveS,111,10,1774623882.0,0.9996808767318726,With the vibes!,comment,1s52nc8,t1_ocs7orf
JahoclaveS,111,11,1774725632.0,0.642155110836029,Furthering my opinion that I don’t even need to puzzle out if it’s ai or not because it’s already bad. ,comment,1s5xdvf,t1_ocy4bsk
cbusmatty,112,0,1773754361.0,0.998236894607544,This is demonstrably more useful and valuable today already.  The pace of improvement has been incredible.  There is no putting this genie back in the box,comment,1rw5l7k,t1_oaxaqj9
cbusmatty,112,10,1774611820.0,0.9834402799606323,Anthropic models have been consistently better by leaps and bounds. Look at what 4.1 opus was doing a year ago and what 4.6 is doing now.  At a third of the cost.  The arrow hasn’t slowed down at all,comment,1s4ugwq,t1_ocqebx1
CheesypoofExtreme,113,1,1773899306.0,-0.9980892539024353,"&gt;You could legislate the website to have rules on mods and anti-bot requirements but it would be still too easy to pretend to be a user to manipulate engagement.


And that has been happening on Reddit for years. I would take that any day over the fucking bot farms we have all over this site now.


Just because a proposed solution isn't perfect or address every issue encountered, that doesn't mean we should just do nothing.


Progress for the sake of progress is still progress.",comment,1rx3xoi,t1_ob4qzgr
BasvanS,114,1,1773911546.0,-0.9990654587745667,Simple: “Why are you (staff) not delivering on other people’s promises?”,comment,1rximkr,t1_ob8c0ou
BasvanS,114,10,1774614022.0,-0.9867064356803894,"Yeah, it’s like they awoke from a decade long coma, talking like that.",comment,1s51flq,t1_ocr8lc0
BasvanS,114,10,1774676557.0,0.988663375377655,Thank you for your kind words. Let’s hope nobody takes the win from me in the last few days 🤞,comment,1s51flq,t1_ocs87yr
SaxAppeal,115,2,1773920870.0,-0.999142050743103,"That’s why I just talk to the thing. If your repo is well structured it can do really well without a ton of setup, if your repo is a mess it will fall all over itself. But I’m not wasting my time harnessing a shitty repo when it’s not worth it, and yes tomorrow’s model will solve 80% of today’s harnessing problems out of the box, so it’s truly a waste of time to harness imo.

Fwiw though I’ve had quite a lot of success creating complex multi-service changes in my company. With nothing but a 1M context window and 2 internal MCPs (one to read docs and slack, the other to read code). If you’re not having success with the tools at this point it’s either a repo layout problem or a prompting problem. This shit _is_ ready at this point. (Harnessing is still a waste of time 80% of the time though)",comment,1rxtuuw,t1_obaa7ly
SaxAppeal,115,5,1774191236.0,-0.9992544054985046,"Source? Becaue that would be so incredibly fucked. Too many people already take ChatGPT’s word as gospel. This just becomes a pathway for corporations to manipulate unsuspecting people for monetary gain. With clear advertisements, which can certainly still be predatory, at least it’s obvious that it’s an ad.",comment,1s0mv9h,t1_obugne1
sump_daddy,116,9,1774530362.0,-0.9959259033203125,Any sufficiently advanced AI company marketing exec is indistinguishable from a True Believer,comment,1s442o9,t1_ocknq4c
sump_daddy,116,9,1774579698.0,-0.9993556141853333,"it worked when the terrible thing was ""dont know algebra"" so i guess they figured why not try the same idea?",comment,1s48e5y,t1_ocoh10d
LaylaHarvey,117,9,1774530788.0,-0.9997583031654358,This makes me feel much better about lighting my marketing “career” on fire. You’ve really gotta buy all the way in to succeed. It’s gross. ,comment,1s442o9,t1_ockp9tm
BossOfTheGame,118,0,1773754269.0,-0.9974305033683777,"it's really not, and this is from someone who was resisting using cloud LLMs in favor of local models for years. the cloud LLMs are so much better than anything you can run on consumer hardware. I hope that changes. I'm anxious for it, but it's not an easy path.

I'd love to be wrong on this, but it seems like they are more than 6 months behind. Unless by doable you mean running an 8 gpu cluster, and even then I'm not sure it's enough. I've only tried local models that can run on 4 blackwells so please tell me if I missed something. ",comment,1rw5l7k,t1_oaxc0bg
SAugsburger,119,0,1773796148.0,-0.9925628304481506,This. You need to understand what AI  can realistically do and what it can't and how to actually get that output.,comment,1rwesuj,t1_oazp40w
SAugsburger,119,9,1774569090.0,-0.9986220598220825,"It could be that, but also could be that they think it is a bubble and want to parachute out of the situation to make it somebody else's problem.",comment,1s4n6zx,t1_ocoe7cs
SAugsburger,119,10,1774639543.0,-0.9996732473373413,"Tech isn't doing so well as NASDAQ moved to correction territory, but MSFT had gotten clobbered more than most. 24% down ytd as I am looking. Probably not going to be a great year for tech this year, but Microsoft isn't managing this well.",comment,1s52nc8,t3_1s52nc8
West-Abalone-171,120,1,1773890529.0,-0.9898067116737366,"Notably, the radiators are much heavier than the solar panels, and a decent chunk of the waste heat is at higher temperatures from things like sabatier reactors.",comment,1rx6z20,t1_ob73pxa
West-Abalone-171,120,4,1774099806.0,-0.9980529546737671,"Stop worrying about a glorified text to speech chatbot taking over the world, and start worrying about the insane christofascist cultist who is on record saying he opposes democracy and hates both nature and humanity who owns it.",comment,1rzdefr,t1_obl5tvo
West-Abalone-171,120,10,1774609070.0,-0.9919913411140442,The goal is to create scarcity then profit from renting to the people who can no longer buy.,comment,1s4absz,t1_oclse3r
elmatador12,121,2,1773974456.0,-0.9807422161102295,"So he wants to spend $100 billion to get rid of jobs with a tech that nobody wants so he and his buddies can make more money they don’t need.  

The American Dream. ",comment,1ryfvka,t3_1ryfvka
elmatador12,121,9,1774541922.0,-0.9990701079368591,"Growing up we had that zero tolerance where you were kicked out immediately if you were caught with drugs. We should do this same sith this. You have AI deepfakes of girls? You’re gone. Doesn’t matter if you made them or not. If you’re caught with them, goodbye. ",comment,1s48e5y,t3_1s48e5y
xamott,122,2,1773983764.0,0.9879733324050903,The likes of which?,comment,1ryfvka,t3_1ryfvka
xamott,122,3,1774016133.0,-0.9988164901733398,Try telling it “use less words”. ,comment,1rxtuuw,t1_obfy6qq
deadflow3r,123,9,1774569251.0,-0.9276071786880493,Bingo. No CEO of a major brand is going to give up their position based on ignorance of a new technology. It's not like you gotta be an AI engineer to understand the basic selling point of it. More than likely investments aren't paying off and they're getting ahead of things.,comment,1s4n6zx,t1_ococlg3
ZanthrinGamer,124,0,1773793393.0,-0.9997138381004333,ai feels like its gotten less and less useful. its like its already hit the point where its become recursive and its amplifying its own fuck ups.,comment,1rwesuj,t3_1rwesuj
ZanthrinGamer,124,2,1773951425.0,-0.9997724890708923,and it can still barely return accurate responses to simple questions...  why does it feel like they are all getting dumber?,comment,1rxtuuw,t3_1rxtuuw
ZanthrinGamer,124,5,1774255457.0,-0.991908073425293,"Talk about training your replacement, ceo would be such a simple position to automate.",comment,1s1b6d0,t3_1s1b6d0
ZanthrinGamer,124,11,1774696024.0,0.5375558137893677,"Sounds like a risky strategy,  lets see how that works out for them. ",comment,1s5x48n,t3_1s5x48n
Mr_ToDo,125,0,1773777361.0,-0.99935382604599,"Oh god

Yes, but why?

I'm pretty sure there have been social media attempts to properly tie your identity to your account. I'd rather have the slop. Having the option wouldn't be horrible, just count me out. It feels a bit like the old AOL internet, but instead of curation of content you're tying your life to it",comment,1rw99an,t1_oaz3fzf
Mr_ToDo,125,3,1774021718.0,-0.9986559152603149,"All in all if they use the patents as they outline it's not the end of the world

But if you want a real reason that surge pricing will face at least some issues then I think you should look up laws about sales pricing. Generally they'll go down the lines of ""You can only list a regular price if it's been the price for X months in the last Y months"". 

There are ways around that too, but it does limit what you can do. The common scam for that is having variations of the product and the one that goes on ""sale"" is the one that sits in the warehouse at it's ""regular price"" until it's time for the sale(TV's, furniture. Stuff like that where it's easier to just add, remove, or change small features). And to some degree grocers are already scamming people. Few people know the regular price of items they buy and if they see sale indicators(color or style of the price tag is common) they'll be inclined to buy it even if it's not really on sale(and they've been removing or shrinking the ""regular"" price so you can't do easy compares

I suppose one thing that we might see at some point is phone apps that do price over time analyses like they have for online stores(shit. some of the more consumer friendly places even go so far as to do something like that themselves). Easier online though, what with being able to scrape prices more easily. You could compare it to online prices to get a close enough I guess",comment,1ryvlei,t1_obhhdlv
Mr_ToDo,125,10,1774617740.0,-0.9995195865631104,"&gt;Not sure why they dropped

probably because they didn't. Looking at all the stocks mentioned, micron and sandisk which was the biggest dips were already dropping at that point, segate and western digital have been up and down since February. Although micron and sandisk were also volatile since February they also both had a bigger boost recently so it makes the fall look worse

All in all, you might as well just pull causes out of your ass for all the good it would do. Why not try blaming it on open ai's cancelling sora's closure announcement? there's a ton of things that can effect those companies and a trend of one small drop doesn't seem like it's really giving enough feedback",comment,1s51flq,t1_ocraa3m
