user,user_idx,time_bin,timestamp,sentiment,text,type,post_id,parent_id
Logical_Welder3467,0,0,1773786586.0,-0.9953131675720215,"OpenAI preps for IPO by end of year, tells employees ChatGPT must be ‘productivity tool’",post,1rwlp28,
Logical_Welder3467,0,0,1773824292.0,-0.9996248483657837,BuzzFeed debuts AI slop apps in bid for new revenue,post,1rwymun,
Logical_Welder3467,0,1,1773832928.0,0.982282817363739,China’s ‘AI tigers’ see shares surge after Nvidia CEO touts OpenClaw as ‘next ChatGPT’,post,1rx15zy,
Logical_Welder3467,0,1,1773834589.0,-0.9977560639381409,"Qihoo 360, one of the biggest cybersecurity companies from China, accidentally shipped a highly sensitive wildcard SSL private certificate inside the public installer for its 360 Security Claw AI assistant. The assistant is the company's wrapper on OpenClaw",post,1rx1psu,
Logical_Welder3467,0,1,1773875871.0,-0.9990575909614563,Pardoned Nikola founder Trevor Milton is trying to raise $1B for AI-powered planes,post,1rxjrjv,
Logical_Welder3467,0,1,1773905170.0,0.9726701378822327,Anthropic's Claude claws its way towards the top of the AI market,post,1rxtuuw,
Logical_Welder3467,0,2,1773962406.0,-0.5544454455375671,"Jeff Bezos is reportedly seeking $100 billion for a new fund, the likes of which will be used to buy up companies in major industrial sectors and, ultimately, modernize and automate them with AI",post,1ryfvka,
Logical_Welder3467,0,3,1774015871.0,-0.9925603866577148,“It feels like Squid Game”: China’s workers scramble to keep up in the AI race,post,1ryxav4,
Logical_Welder3467,0,3,1774076686.0,-0.9112786650657654,"Trump’s AI framework targets state laws, shifts child safety burden to parents",post,1rzky0n,
Logical_Welder3467,0,4,1774138006.0,-0.5228182673454285,"How the red-hot AI data center boom is igniting demand for a new, lucrative career path: Trade workers",post,1s06yb8,
Logical_Welder3467,0,4,1774138257.0,-0.9994612336158752,"Rogue OpenClaw AI wrote and published 'hit piece' on a Python developer who rejected its code — disgruntled bot accuses Matplotlib maintainer of discrimination and hypocrisy, later backtracks with an apology",post,1s071qu,
Logical_Welder3467,0,4,1774171420.0,-0.999188244342804,Are AI tokens the new signing bonus or just a cost of doing business?,post,1s0h6im,
Logical_Welder3467,0,5,1774182675.0,0.9679136872291565,OpenAI’s data center pivot underscores Wall Street spending concerns ahead of IPO,post,1s0keuy,
Logical_Welder3467,0,5,1774246407.0,-0.9992831349372864,Sashiko: AI code review system for the Linux kernel spots bugs humans miss,post,1s191ii,
Logical_Welder3467,0,6,1774307585.0,-0.9919791221618652,Google unleashes Gemini AI agents on the dark web,post,1s1wxyu,
Logical_Welder3467,0,6,1774324981.0,-0.999734103679657,Telling an AI model that it’s an expert programmer makes it a worse programmer,post,1s23kp8,
Logical_Welder3467,0,7,1774360176.0,-0.811739444732666,"Alibaba, China internet giants eye $84bn in AI investment for 2027",post,1s2ebd4,
Logical_Welder3467,0,7,1774389845.0,-0.9992893934249878,OpenAI shutters short-form video app Sora as company reels in costs,post,1s2rzsg,
Logical_Welder3467,0,7,1774422599.0,-0.9954209923744202,SAP already shifting focus from ERP migration disaster in pursuit of AI-driven growth,post,1s33rpi,
Logical_Welder3467,0,8,1774482550.0,-0.9960753321647644,"The AI skills gap is here, says AI company, and power users are pulling ahead",post,1s3rkbj,
Logical_Welder3467,0,8,1774486238.0,-0.9943027496337891,The point of the system is for these analyst to process 100x time more data,comment,1s3rqj0,t1_ochw42l
Logical_Welder3467,0,8,1774494571.0,-0.9981669187545776,HP stuffs OpenAI LLM into new laptops in bid for small biz,post,1s3w4hc,
Logical_Welder3467,0,9,1774566627.0,-0.9794251322746277,"Defense startup Shield AI lands $12.7B valuation, up 140%, after US Air Force deal",post,1s4n3iw,
Logical_Welder3467,0,9,1774572554.0,0.9913721084594727,Meta boosts investment in West Texas AI data center by over sixfold to $10 billion,post,1s4ph6q,
Logical_Welder3467,0,9,1774586057.0,-0.9997214674949646,China’s not thrilled its AI experts want to leave the country,post,1s4ud7e,
Logical_Welder3467,0,10,1774694855.0,-0.981793999671936,SoftBank has taken on a new $40 billion loan to help it cover its $30 billion commitment to invest in OpenAI,post,1s5x48n,
SaveDnet-FRed0,1,0,1773767349.0,-0.9993719458580017,"It's been time to ""quit 'AI' (LLM's)"" for at LEAST over 2 and a half years. Only difference between now and then is that it's becoming increasingly obvious that LLM's are a scam and not worth it outside some very hyper specific circumstances, and even then those circumstances require a model custom trained for the exact function that it's to be used for as opposed to all the major omnibus ""do anything"" models all the big big tec. company's are pushing.

Especially since ""Open AI"" is proving just how unsustainable and not meeting the hype this technology is. Especially since the majority of people who use the internet do not care about LLM's or (like me) actively hate them. Especially since even major clueless corporateinvestors are starting to see that this LLM fad is a bubble starting to pop.",comment,1rw5l7k,t3_1rw5l7k
SaveDnet-FRed0,1,0,1773768309.0,-0.9995536208152771,"Blocking the Internet Archive Won’t Stop AI, But It Will Erase the Web’s Historical Record",post,1rwd2ch,
SaveDnet-FRed0,1,1,1773855567.0,-0.9783788919448853,"One means it's actively being considered

The other is basically corporate/politician speech for ""Were not 100% against this idea, but are not actually doing anything in regards to it at this time, but want to make it look like we will in the foreseeable future regardless of if we will or not.""",comment,1rx3xoi,t1_ob5dpq7
SaveDnet-FRed0,1,1,1773855687.0,-0.9955452680587769,"Ok, 2 questions:

1) When are you going to start actually considering it as opposed to considering the possibility of considering it?

2) What are you going to do when AI company's/people start ignoring your label mandate?",comment,1rx3xoi,t3_1rx3xoi
SaveDnet-FRed0,1,2,1773941828.0,-0.9019762277603149,"Firefox 149 will offer a free built-in VPN, split views, tab notes and optional AI windows",post,1ry70i7,
SaveDnet-FRed0,1,2,1773943602.0,0.9666540026664734,"Yes, AI slop is bad. But Firefox has a AI kill switch toggle in the settings witch when enabled disables all AI functions in the browser with a single click until it's manually toggled back off.

But the tab notes and free VPN are positive additions.",comment,1ry70i7,t1_obcf5q9
SaveDnet-FRed0,1,6,1774287779.0,0.9607992768287659,AI &amp; Tech Brief: The strategy behind GOP’s AI framework,post,1s1nv3g,
SaveDnet-FRed0,1,6,1774289831.0,-0.9848240613937378,Free VPN has a limit of 50 GB and the ability to upgrade by paying money.,comment,1ry70i7,t1_obdgufb
SaveDnet-FRed0,1,8,1774460842.0,-0.993442177772522,"It's not been quite a week yet, but it has been 6 days. So almost.",comment,1ry70i7,t1_obkmc8u
SaveDnet-FRed0,1,8,1774461736.0,-0.997795581817627,"That's probably Windows more then Firefox, try running it on Linux.",comment,1ry70i7,t1_obcnqgm
SaveDnet-FRed0,1,9,1774548080.0,0.9996373653411865,fair enough,comment,1ry70i7,t1_obe8ycs
socoolandawesome,2,3,1774042815.0,-0.9985872507095337,OpenAI is throwing everything into building a fully automated researcher,post,1rz95qq,
socoolandawesome,2,9,1774529709.0,0.9993714690208435,"Surprising to actually see you upvoted lol, but you are spot on. Openai is just being smart. Redditors were celebrating sora being canned and Disney consequently pulling their $1B investment… and like the next day OAI raised another $10B lol.
",comment,1s45g56,t1_ockihlc
socoolandawesome,2,9,1774586388.0,-0.976036012172699,"Exclusive: Anthropic acknowledges testing new AI model representing ‘step change’ in capabilities, after accidental data leak reveals its existence",post,1s4ugwq,
socoolandawesome,2,10,1774621716.0,0.9925209283828735,It’s not that hard it either performs better when you code or it doesn’t. Like it literally could do something now that it couldn’t before.,comment,1s4ugwq,t1_ocrz936
socoolandawesome,2,11,1774703536.0,-0.9908650517463684,"They didn’t loan OpenAI money, they invested. OpenAI doesn’t owe SoftBank money. Bank will only take on a loan of that size assuming it’s likely they will be paid back ",comment,1s5x48n,t1_ocxrqcj
socoolandawesome,2,12,1774803590.0,0.9553222060203552,Eli Lilly reaches $2.75 billion deal with Insilico to bring AI-developed drugs to the global market,post,1s70hqz,
gdelacalle,3,1,1773831172.0,-0.9520065784454346,"Americans Recognize AI as a Wealth Inequality Machine, Pollster Finds",post,1rx0lba,
gdelacalle,3,1,1773911105.0,-0.9858354330062866,Amazon Alexa's UK personality to change with Echo AI update,post,1rxvdd2,
gdelacalle,3,3,1774007549.0,-0.9908626079559326,"Super Micro shares plunge as US charges co-founder, 2 more for smuggling AI chips to China",post,1ryu67o,
gdelacalle,3,5,1774189236.0,0.955730676651001,OpenAI to introduce ads to all ChatGPT free and Go users in US,post,1s0mv9h,
gdelacalle,3,5,1774253017.0,-0.9046002626419067,Why refusing AI is a fight for the soul (opinion article),post,1s1asp2,
gdelacalle,3,6,1774348062.0,-0.9921956062316895,Jensen Huang says Nvidia engineers should use AI tokens worth half their annual salary every year to be fully productive — compares not using AI to using paper and pencil for designing chips,post,1s29zvb,
gdelacalle,3,7,1774428974.0,-0.9996126294136047,OpenAI’s Sora was the creepiest app on your phone -- now it's shutting down (opinion article),post,1s35f7k,
gdelacalle,3,9,1774542320.0,-0.9965842962265015,A ‘pound of flesh’ from data centers: one senator's answer to AI job losses,post,1s4c8hl,
AutoX_Advice,4,10,1774615589.0,-0.9992383718490601,"Time to help the ceo pack his bags.   


Its been comical to have seen the copilot button stuck on everything like a popup you accidentally click on. ",comment,1s52nc8,t3_1s52nc8
numba1cyberwarrior,5,0,1773789705.0,-0.9543220400810242,"If you get good plastic surgery you will look much better than other people, no one notices, and then people will circle jerk about how you aged so naturally. ",comment,1rwbqp8,t1_oayo8o2
numba1cyberwarrior,5,1,1773846252.0,-0.8413729667663574,"Comparing guns to AI images is hilarious. 

It will literally be impossible to enforce this. ",comment,1rx3xoi,t1_ob49bi7
numba1cyberwarrior,5,6,1774286805.0,0.9995775818824768,The military has been using these systems for a long time and they increase precision ,comment,1s1ewzd,t1_oc08qal
numba1cyberwarrior,5,8,1774493006.0,-0.9931634664535522,"1) They aren't, analysts cost an absurd amount of money.

2) You can have shortages of analysts due to a million different factors from broken training pipelines, to issues attracting talent, to a long security clearance process. You don't have that issue with AI 

3) These AI systems are simply capable of doing things that humans can't

4) One of the primary purpose of modern military warfare is to integrate things like sensors, increase command and control, and shorten kill chains. While having better analysts helps with these things, it has primarily been driven by new technology.",comment,1s3rqj0,t1_ochw42l
coconutpiecrust,6,0,1773753918.0,0.980330765247345,"It’s interesting that there is regulation surrounding nuclear power plants, but not this. As far as I understand the environmental impact on the surrounding communities is devastating, but it’s ok because techbros want this. 

Just a couple of deranged techbros. My, oh my. Can someone tell them “no”, please? 
",comment,1rw5l7k,t3_1rw5l7k
coconutpiecrust,6,2,1773975284.0,-0.9968087077140808,"The techbros told everyone to breed so that they can starve more people to death, it seems. ",comment,1ryfvka,t1_obe90dr
coconutpiecrust,6,3,1774021482.0,0.9993009567260742,"She looks very Russian. The article contains some images and they just look like something a Russian would generate. I can’t quite explain it, but I just know. The mannerism, the hair, the body proportions of the woman, the poses… and there is a pic of her, Trump, and Putin. 

That pretty much sums it up. 
",comment,1ryyz20,t1_obi1xoy
coconutpiecrust,6,5,1774258370.0,-0.999578058719635,"He should be laid off, too, and replaced with an unpaid intern. ",comment,1s1b6d0,t1_obzfhtu
coconutpiecrust,6,9,1774528502.0,-0.9995194673538208,"Considering this

 https://apnews.com/article/artificial-intelligence-deepfake-lancaster-ai-5eccb10ae81244fe475a32867f9ca2c9?utm_source=copy&amp;utm_medium=share

Maybe porn is not a good idea. ",comment,1s45g56,t1_ockhbu2
coconutpiecrust,6,13,1774882884.0,-0.998868465423584,"A human would write a blog post because they felt offended. Why would an AI agent write a post? They can’t feel. 

What kind of training are these agents receiving?
",comment,1s7rl4i,t1_odbe4nr
Balmung60,7,0,1773758545.0,0.867735743522644,"No, the time to quit AI, or at least generative AI was 2020, when the first generative AI applications were becoming available (and yes, generative AI applications predate GPT-3). However, the next best time is right now.",comment,1rw5l7k,t3_1rw5l7k
Balmung60,7,2,1773991879.0,-0.9996479749679565,But will they remove the dedicated slot for AI slop in my recommendations when I listen to music?,comment,1rykq36,t3_1rykq36
Balmung60,7,9,1774530301.0,-0.9995712637901306,"The problem is that it *has* to be big and inefficient for them to have a business at all. If it was small and efficient, anyone could run a chatbot on local hardware or within already existing cloud environments. And if anyone can do it at that scale, OpenAI and Anthropic and such neither have a reason to keep coming to investors begging for infinity dollars not a business that anyone has a real reason to go to them for. That it's so big and inaccessible for anyone without enormous data centers creates a moat and means you have to come to them and use their compute and their chatbot. And even if you would go to a specialist company anyways, smaller and more efficient models would mean it would be far too easy for someone else to spin up a competitor.",comment,1s45g56,t1_ockmvfy
Balmung60,7,10,1774609348.0,-0.9987736344337463,"I don't care how good it is at the test scores designed to market the AI and which the AI is obviously going to be designed to do better at. Previous models have boosted their scores too, but regardless of the quantified improvement, the qualitative move has been from trash to trash.


What I care about is that it's a slop machine that through unethically sourced inputs sets a bunch of money on fire to produce outputs that nobody wants to consume.",comment,1s4ugwq,t1_ocpurpe
Balmung60,7,12,1774839494.0,0.8777065873146057,And it means they don't have to admit past fault for overhiring,comment,1s7dfb3,t1_od8ll4m
No_Top_9023,8,0,1773751739.0,-0.997126042842865,The environmental cost of datacentres is rising. Is it time to quit AI?,post,1rw5l7k,
No_Top_9023,8,2,1773920948.0,-0.9943773150444031,Government panel wants Google and OpenAI to pay content creators for AI training use,post,1rxy986,
No_Top_9023,8,4,1774121685.0,-0.999747097492218,Publisher Cancels 'Shy Girl' Horror Novel After Writer Accused of Using AI,post,1s00jed,
No_Top_9023,8,5,1774177967.0,-0.9933550357818604,"2,400 Kaiser mental health professionals strike in Northern California over AI concerns",post,1s0iykh,
No_Top_9023,8,7,1774425518.0,-0.9915180802345276,How Standard Chartered runs AI under privacy rules,post,1s34jfr,
No_Top_9023,8,9,1774525549.0,-0.9934998750686646,"Meta, AWS blame human error after AI agents go rogue",post,1s456fj,
No_Top_9023,8,9,1774599472.0,0.6812217235565186,Anthropic sends 'thanks note' as Judge temporarily blocks Pentagon from declaring Anthropic 'national security risk',post,1s4y5o1,
No_Top_9023,8,11,1774695754.0,-0.9895188212394714,"Writer denies it, but publisher pulls horror novel after multiple allegations of AI use",post,1s5xdvf,
No_Top_9023,8,11,1774760626.0,-0.998489499092102,Study: Sycophantic AI can undermine human judgment,post,1s6m9cl,
No_Top_9023,8,13,1774868387.0,-0.9952813982963562,"Police Used AI Facial Recognition: Tennessee woman who spent months in jail after police used AI facial recognition to link her to crimes in Dakota, says she has never been to the State",post,1s7nbe3,
br_k_nt_eth,9,2,1773936435.0,-0.9907587766647339,Communications/Marketing went through this quasi-death spiral with social media and content automation a couple decades ago. We learned to train up but not replace. The industry has this big generational gap with a lack of senior knowledge now because of it. My generation of leaders who are on the rise are so serious about training junior team members up on the latest skills *and* the core skills rather than just replacing them because of this. I so hope coding folks learn the same lesson without the pain.,comment,1rximkr,t1_obb3gpb
br_k_nt_eth,9,6,1774287322.0,-0.9974933862686157,"Come on bro, people need to be realistic about the limitations of this technology. It’s not a literal miracle worker. 

(/s just in case it’s needed) 
",comment,1s1b6d0,t1_obzfm7e
br_k_nt_eth,9,8,1774450138.0,-0.9993475079536438,"God, it really shows as well. They’re so dumb it’s fucking embarrassing. Like seriously, our oligarchs and their offspring are shamefully soft and stupid. ",comment,1s39x19,t1_oce40jv
br_k_nt_eth,9,13,1774884386.0,-0.9925782084465027,Okay but enough about brain damaged CEOs,comment,1s7oy34,t1_odazh20
Lashay_Sombra,10,2,1773920717.0,-0.9906275272369385,"&gt; Opus is a very real step towards replacing junior devs

That is going to create an absolute disaster down the road, because once the senior devs retire/leave there will be no new senior coming down the pipeline, because no one has been hiring juniors and giving them the real world experience needed to become seniors

",comment,1rximkr,t1_ob98sup
Lashay_Sombra,10,5,1774179672.0,-0.9985186457633972,"Except its looking like they wont be able to get it at a price point that people will pay for and where they can make profit, there is currently no overlap. Even with the users on the most expensive plans (hundreds $$ per month) AI company's are still losing money (though some are arguing that because those willing to pay that amount are the heaviest users, but then that means they need a gym like model to work, ie people pay but barely use)

That's part of the reason lot of the focus is now moving into trying to run AI for less, mainly in power consumption

Other reason is they are starting to simply dead end on actual capability advancements, days of AI improving by leaps and bounds are over, we are very unlikely to see 'amazing' new capabilities/functionality",comment,1rzqmat,t1_obocyp9
Lashay_Sombra,10,7,1774431773.0,0.9995146989822388,"Define real, because we have people promising everything from chatbots to Skynets ",comment,1s2gt0a,t1_oc8b7vg
Smith6612,11,2,1773952918.0,-0.9993563294410706,"I do wish that Firefox would still focus on Speed and stability.


I've been having an issue with Firefox lately where networking on it just... Halts. For a few minutes at a time. Only on Windows, and I have no idea why. Firefox will claim it is completely offline, all while Steam, Edge, Discord, and Command Line tools continue to work. ",comment,1ry70i7,t1_obcg6ia
Smith6612,11,3,1774012635.0,-0.9982426166534424,I've had that before with DirecTV Stream and a few other services! Takes the site months sometimes to fix it. Other times it's Firefox's tracking blockers breaking the page. ,comment,1ry70i7,t1_obh5gaf
Smith6612,11,9,1774562841.0,-0.9982044696807861,"All these AI companies forgot to code for Celerons. If the Data Centers could simply buy those up, we'd stop seeing them in budget laptops.

You hear that, AI? All you need is a Celeron. Self Optimize!",comment,1s4absz,t3_1s4absz
Loganp812,12,0,1773766923.0,-0.9989162683486938,"People need food to survive, and *no one* needs LLMs for anything. We didn’t need them several years ago before they were invented commercial use, we don’t need them now, and we won’t need them in the future.

Granted, there are better options for food, but that’s still as about as useful of a counterpoint as “Well, people collectively waste more water daily by taking a shower than data centers do to generate slop that’s not even correct half the time.”",comment,1rw5l7k,t1_oaxd3dz
Loganp812,12,3,1774006274.0,-0.9991497993469238,"The issue is that Google is essentially asking us to train and refine Gemini for them by doing this. 

It would also be easy for trolls to abuse, and if Google really cared about making users aware of which videos are worth watching then they’d add the like/dislike ratio meter back.",comment,1rykq36,t1_obfyn0t
Loganp812,12,4,1774142926.0,-0.9886850714683533,"“Okay, what are your hobbies?”

“Magnets.”

“Okay… building magnets? Experimenting with magnets?”

“Just magnets.”",comment,1rztol1,t1_obp685b
Loganp812,12,6,1774293156.0,0.9844034910202026,"“Metabot, what is love? How does a real human being experience it? Is it worth the investment?”",comment,1s1b6d0,t1_obzfm7e
Loganp812,12,7,1774360563.0,0.5298781394958496,That or Grok was specifically instructed to adopt an alt-right persuasion in its answers in order to fit with Elon’s agendas which naturally led it to becoming Mecha Hitler.,comment,1s2cme5,t1_oc77rnl
Loganp812,12,9,1774532132.0,-0.9997321963310242,"The problem is LLM technology itself. It doesn’t matter how much power, training, and other resources you put into it. 

It cannot and will not have the capacity to actually think, and it will always be plagued by the hallucination problem because LLMs are basically autocomplete on steroids. They can only respond to user inputs, and they choose words based on the most likely order that makes sense according to their training (or code, visual art, audio, etc.) That means sometimes the answer won’t be clear-cut or some of the training material may contradict other training material, so it “hallucinates” and generates something that is either incorrect or makes no sense at all despite being assertive about it. How would it even know that it’s being incorrect anyway? It’s a dead-end technology with diminishing returns for each new update, and it seems that OpenAI may have reached that point with GPT-5.

Then there’s the issue of more powerful LLMs requiring more data centers which draw a ridiculous amount of power and need a lot of water for cooling, and more users (both private and commercial) necessitates more data centers. Data centers run at a tremendous financial loss because LLMs are very inefficient and not profitable at all, and that’s why these tech companies are trying to shoehorn LLMs into every application and market possible in order to attract more investors to keep their stocks afloat.

That said, it’s not an entirely useless technology in some specific applications, but the problem is that it’s still very resource-heavy and expensive on the backend which means they still have to market it as this miracle product that can be used for every purpose you can imagine. Ironically, that also drives up the costs even more. It’s all about short-term gains at the expense of long-term consequences.",comment,1s45g56,t1_ockrqo4
Loganp812,12,10,1774624711.0,-0.5234783887863159,"Because it’s not just about disclosing a new model to investors but also finding a sneaky way to entice the general public into using it. They need the investors to keep their stocks afloat, and they need a user base to prove the “value” of their product.",comment,1s4ugwq,t1_ocs9bgp
Loganp812,12,13,1774888544.0,-0.9310630559921265,"Long-term, sure, but that’s money *later*. Shareholders and corporations care about money *now* - the consequences be damned.",comment,1s7dfb3,t1_od9ee46
QuickQuirk,13,1,1773833274.0,-0.9929651021957397,"Don't be ridiculous. There will be a virtual trade in fee. You can sell your old virtual 5090 to someone else.  
You'll have an NVidia Financial Transaction record: an NFT.",comment,1rwde7b,t1_oaz6bh5
QuickQuirk,13,1,1773910971.0,0.8803218603134155,I have. It just requires the right cuts. Starting from the top.,comment,1rximkr,t1_ob96rlo
QuickQuirk,13,5,1774194655.0,-0.9993471503257751,"The best source here is history.
Examine every other similar case.
Facebook.
Google search results.

Each directly reduces the utility to you in favour of improving ad revenue.

Sergei and Larry famously wrote in a paper in the 90's that ""We expect that advertising funded search engines will be inherently biased towards the advertisers and away from the needs of the consumers.""


But here we are, 30 years later, and google search results are *worse* as they focus on pushing you to site that generate ad revenue for themselves.

Same thing will inevitably happen with 'free AI'.
If the quality of the results conflicts with advertising revenue, then advertising will win.",comment,1s0mv9h,t1_obuhx8g
QuickQuirk,13,10,1774618434.0,-0.998218834400177,"&gt; I haven't given it full permissions yet as I don't trust it fully yet with that power

Don't: Don't ever give any agentic system based on the current LLM technologies full permissions, as you're always vulnerable to prompt injection. You may return to find your computer completely hyjacked.

Always review every task it runs apart from the most trivial, like grepping your codebase.",comment,1s4ugwq,t1_ocq7se0
QuickQuirk,13,11,1774722659.0,0.9998835325241089,"Indy games.
Reward those little studios.",comment,1s61pjs,t1_oczkxkx
